contestId,index,name,rating,tags
815,B,Karen and Test,2200.0,"brute force, combinatorics, constructive algorithms, math"
815,A,Karen and Game,1700.0,"brute force, greedy, implementation"
814,E,An unavoidable detour for home,2600.0,"combinatorics, dp, graphs, shortest paths"
814,D,An overnight dance in discotheque,2000.0,"dfs and similar, dp, geometry, greedy, trees"
814,C,An impassioned circulation of affection,1600.0,"brute force, dp, strings, two pointers"
814,B,An express train to reveries,1300.0,constructive algorithms
814,A,An abandoned sentiment from past,900.0,"constructive algorithms, greedy, implementation, sortings"
813,F,Bipartite Checking,2500.0,"data structures, dsu, graphs"
813,E,Army Creation,2200.0,"binary search, data structures"
813,D,Two Melodies,2600.0,"dp, flows"
813,C,The Tag Game,1700.0,"dfs and similar, graphs"
813,B,The Golden Age,1800.0,"brute force, math"
813,A,The Contest,1100.0,implementation
812,E,Sagheer and Apple Tree,2300.0,"games, trees"
812,D,Sagheer and Kindergarten,2700.0,"dfs and similar, graphs, implementation, trees"
812,C,Sagheer and Nubian Market,1500.0,"binary search, sortings"
812,B,"Sagheer, the Hausmeister",1600.0,"bitmasks, brute force, dp"
812,A,Sagheer and Crossroads,1200.0,implementation
811,E,Vladik and Entertaining Flags,2600.0,"data structures, dsu, graphs"
811,D,Vladik and Favorite Game,2100.0,"constructive algorithms, dfs and similar, graphs, interactive"
811,C,Vladik and Memorable Trip,1900.0,"dp, implementation"
811,B,Vladik and Complicated Book,1200.0,"implementation, sortings"
811,A,Vladik and Courtesy,800.0,"brute force, implementation"
810,B,Summer sell-off,1300.0,"greedy, sortings"
810,A,Straight <<A>>,900.0,"implementation, math"
809,E,Surprise me!,3100.0,"divide and conquer, math, number theory, trees"
809,D,Hitchhiking in the Baltic States,2900.0,"data structures, dp"
809,C,Find a car,2600.0,"combinatorics, divide and conquer, dp"
809,B,Glad to see you!,2200.0,"binary search, interactive"
809,A,Do you want a date?,1500.0,"implementation, math, sortings"
808,G,Anthem of Berland,2300.0,"dp, strings"
808,F,Card Game,2400.0,"binary search, flows, graphs"
808,E,Selling Souvenirs,2300.0,"binary search, dp, greedy, ternary search"
808,D,Array Division,1900.0,"binary search, data structures, implementation"
808,C,Tea Party,1400.0,"constructive algorithms, greedy, sortings"
808,B,Average Sleep Time,1300.0,"data structures, implementation, math"
808,A,Lucky Year,900.0,implementation
807,B,T-Shirt Hunt,1300.0,"brute force, implementation"
807,A,Is it rated?,900.0,"implementation, sortings"
805,B,3-palindrome,1000.0,constructive algorithms
805,A,Fake NP,1000.0,"greedy, math"
804,F,Fake bullions,3400.0,"combinatorics, dfs and similar, dp, graphs, number theory"
804,E,The same permutation ,3100.0,constructive algorithms
804,D,Expected diameter of a tree,2500.0,"binary search, brute force, dfs and similar, dp, sortings, trees"
804,C,Ice cream coloring,2200.0,"constructive algorithms, dfs and similar, greedy"
804,B,Minimum number of steps,1400.0,"combinatorics, greedy, implementation, math"
804,A,Find Amir,1000.0,"constructive algorithms, greedy, math"
803,G,Periodic RMQ Problem,2300.0,data structures
803,F,Coprime Subsequences,2000.0,"bitmasks, combinatorics, number theory"
803,E,Roma and Poker,2000.0,"dp, graphs"
803,D,Magazine Ad,1900.0,"binary search, greedy"
803,C,Maximal GCD,1900.0,"constructive algorithms, greedy, math"
803,B,Distances to Zero,1200.0,constructive algorithms
803,A,Maximal Binary Matrix,1400.0,constructive algorithms
802,M3,April Fools' Problem (hard),2900.0,"binary search, data structures, flows"
802,M2,April Fools' Problem (medium),2400.0,"binary search, flows, graphs"
802,M1,April Fools' Problem (easy),1200.0,"greedy, sortings"
802,J3,Send the Fool Further! (hard),2400.0,"dfs and similar, dp, math, trees"
802,J2,Send the Fool Further! (medium),2100.0,"dp, trees"
802,J1,Send the Fool Further! (easy),1400.0,"dfs and similar, graphs, trees"
802,G3,Fake News (hard),2300.0,string suffix structures
802,G2,Fake News (medium),2200.0,"constructive algorithms, strings"
802,G1,Fake News (easy),800.0,"implementation, strings"
802,D3,Marmots (hard),2800.0,"math, probabilities"
802,D2,Marmots (medium),2200.0,math
802,D1,Marmots (easy),2100.0,math
802,A3,Heidi and Library (hard),2600.0,"flows, graphs"
802,A2,Heidi and Library (medium),1800.0,"data structures, greedy"
802,A1,Heidi and Library (easy),1800.0,greedy
801,B,Valued Keys,900.0,"constructive algorithms, greedy, strings"
801,A,Vicious Keyboard,1100.0,brute force
799,G,Cut the pie,3500.0,"binary search, data structures, geometry"
799,F,Beautiful fountains rows,3500.0,data structures
799,E,Aquarium decoration,2500.0,"data structures, greedy, two pointers"
799,D,Field expansion,2100.0,"brute force, dp, meet-in-the-middle"
799,C,Fountains,1800.0,"binary search, data structures, implementation"
799,B,T-shirt buying,1400.0,"data structures, implementation"
799,A,Carrot Cakes,1100.0,"brute force, implementation"
798,E,Mike and code of a permutation,3000.0,"constructive algorithms, data structures, graphs, sortings"
798,D,Mike and distribution,2400.0,"constructive algorithms, sortings"
798,C,Mike and gcd problem,1700.0,"dp, greedy, number theory"
798,B,Mike and strings,1300.0,"brute force, dp, strings"
798,A,Mike and palindrome,1000.0,"brute force, constructive algorithms, strings"
797,F,Mice and Holes,2600.0,"data structures, dp, greedy, sortings"
797,E,Array Queries,2000.0,"brute force, data structures, dp"
797,D,Broken BST,2100.0,"data structures, dfs and similar"
797,C,Minimal string,1700.0,"data structures, greedy, strings"
797,B,Odd sum,1400.0,"dp, greedy, implementation"
797,A,k-Factorization,1100.0,"implementation, math, number theory"
796,F,Sequence Recovery,2800.0,"bitmasks, data structures, greedy"
796,E,Exam Cheating,2400.0,"binary search, dp"
796,D,Police Stations,2100.0,"constructive algorithms, dfs and similar, dp, graphs, shortest paths, trees"
796,C,Bank Hacking,1900.0,"constructive algorithms, data structures, dp, trees"
796,B,Find The Bone,1300.0,implementation
796,A,Buying A House,800.0,"brute force, implementation"
794,G,Replace All,3400.0,"combinatorics, dp, math"
794,F,Leha and security system,2800.0,data structures
794,E,Choosing Carrot,2800.0,"games, math"
794,D,Labelling Cities,2400.0,"dfs and similar, graphs, hashing"
794,C,Naming Company,1800.0,"games, greedy, sortings"
794,B,Cutting Carrot,1200.0,"geometry, math"
794,A,Bank Robbery,800.0,"brute force, implementation"
793,G,Oleg and chess,3400.0,"data structures, divide and conquer, flows, graph matchings"
793,F,Julia the snail,3000.0,"data structures, divide and conquer, dp"
793,E,Problem of offices,2900.0,"constructive algorithms, dfs and similar, dp, trees"
793,D,Presents in Bankopolis,2100.0,"dp, graphs, shortest paths"
793,C,Mice problem,2300.0,"geometry, implementation, math, sortings"
793,B,Igor and his way to work,1600.0,"dfs and similar, graphs, implementation, shortest paths"
793,A,Oleg and shares,900.0,"implementation, math"
792,F,Mages and Monsters,3100.0,"data structures, geometry"
792,E,Colored Balls,2500.0,"greedy, math, number theory"
792,D,Paths in a Complete Binary Tree,1900.0,"bitmasks, trees"
792,C,Divide by Three,2000.0,"dp, greedy, math, number theory"
792,B,Counting-out Rhyme,1300.0,implementation
792,A,New Bus Route,1100.0,"implementation, sortings"
791,A,Bear and Big Brother,800.0,implementation
789,B,Masha and geometric depression,1700.0,"brute force, implementation, math"
789,A,Anastasia and pebbles,1100.0,"implementation, math"
788,E,New task,2900.0,data structures
788,D,Finding lines,3000.0,"constructive algorithms, divide and conquer, interactive"
788,C,The Great Mixing,2300.0,"dfs and similar, graphs, shortest paths"
788,B,Weird journey,2100.0,"combinatorics, constructive algorithms, dfs and similar, dsu, graphs"
788,A,Functions again,1600.0,"dp, two pointers"
787,B,Not Afraid,1300.0,"greedy, implementation, math"
787,A,The Monster,1200.0,"brute force, math, number theory"
786,E,ALT,3200.0,"data structures, flows, graphs, trees"
786,D,Rap God,3400.0,"data structures, dfs and similar, hashing, strings, trees"
786,C,Till I Collapse,2400.0,"data structures, divide and conquer"
786,B,Legacy,2300.0,"data structures, graphs, shortest paths"
786,A,Berzerk,2000.0,"dfs and similar, dp, games"
785,E,Anton and Permutation,2200.0,"brute force, data structures"
785,D,Anton and School - 2,2300.0,"combinatorics, dp, math, number theory"
785,C,Anton and Fairy Tale,1600.0,"binary search, math"
785,B,Anton and Classes,1100.0,"greedy, sortings"
785,A,Anton and Polyhedrons,800.0,"implementation, strings"
784,G,BF Calculator,2000.0,*special
784,F,Crunching Numbers Just for You,1900.0,"*special, implementation"
784,E,Twisted Circuit,2000.0,"*special, brute force, implementation"
784,D,Touchy-Feely Palindromes,1900.0,"*special, implementation"
784,C,INTERCALC,1800.0,"*special, implementation"
784,B,Kids' Riddle,2000.0,*special
784,A,Numbers Joke,1700.0,*special
780,H,Intranet of Buses,3100.0,"binary search, geometry, implementation, two pointers"
780,G,Andryusha and Nervous Barriers,2700.0,"data structures, dp"
780,F,Axel and Marston in Bitland,2400.0,"bitmasks, dp, graphs, matrices"
780,E,Underground Lab,2100.0,"constructive algorithms, dfs and similar, graphs"
780,D,Innokenty and a Football League,1900.0,"2-sat, graphs, greedy, implementation, shortest paths, strings"
780,C,Andryusha and Colored Balloons,1600.0,"dfs and similar, graphs, greedy, trees"
780,B,The Meeting Place Cannot Be Changed,1600.0,binary search
780,A,Andryusha and Socks,800.0,implementation
779,C,Dishonest Sellers,1200.0,"constructive algorithms, greedy, sortings"
779,B,Weird Rounding,1100.0,"brute force, greedy"
779,A,Pupils Redistribution,1000.0,"constructive algorithms, math"
778,E,Selling Numbers,3000.0,"dp, sortings"
778,D,Parquet Re-laying,2700.0,constructive algorithms
778,C,Peterson Polyglot,2500.0,"brute force, dfs and similar, dsu, hashing, strings, trees"
778,B,Bitwise Formula,1800.0,"bitmasks, brute force, dfs and similar, expression parsing, implementation"
778,A,String Game,1700.0,"binary search, greedy, strings"
777,E,Hanoi Factory,2000.0,"brute force, data structures, dp, greedy, sortings"
777,D,Cloud of Hashtags,1800.0,"binary search, greedy, implementation, strings"
777,C,Alyona and Spreadsheet,1600.0,"binary search, data structures, dp, greedy, implementation, two pointers"
777,B,Game of Credit Cards,1300.0,"data structures, dp, greedy, sortings"
777,A,Shell Game,1000.0,"constructive algorithms, implementation, math"
776,G,Sherlock and the Encrypted Data,2900.0,"bitmasks, combinatorics, dp"
776,F,Sherlock's bet to Moriarty,2800.0,"constructive algorithms, data structures, divide and conquer, geometry, graphs, implementation, trees"
776,E,The Holmes Children,2100.0,"math, number theory"
776,D,The Door Problem,2000.0,"2-sat, dfs and similar, dsu, graphs"
776,C,Molly's Chemicals,1800.0,"binary search, brute force, data structures, implementation, math"
776,B,Sherlock and his girlfriend,1200.0,"constructive algorithms, number theory"
776,A,A Serial Killer,900.0,"brute force, implementation, strings"
775,A,University Schedule,2900.0,*special
774,L,Bars,2000.0,"*special, binary search"
774,K,Stepan and Vowels,1600.0,"*special, implementation, strings"
774,J,Stepan's Series,2000.0,"*special, dp"
774,I,Composing Of String,2300.0,"*special, dp"
774,H,Repairing Of String,2200.0,"*special, constructive algorithms"
774,G,Perfectionist Arkadiy,2700.0,"*special, number theory"
774,F,Pens And Days Of Week,2700.0,"*special, binary search, number theory"
774,E,Big Number and Remainder,2300.0,"*special, math, number theory"
774,D,Lie or Truth,1500.0,"*special, constructive algorithms, implementation, sortings"
774,C,Maximum Number,1200.0,"*special, constructive algorithms, greedy, implementation"
774,B,Significant Cups,2100.0,"*special, binary search, data structures, two pointers"
774,A,Amusement Park,2100.0,"*special, ternary search"
773,F,Test Data Generation,3400.0,"combinatorics, divide and conquer, dp, fft, math, number theory"
773,E,Blog Post Rating,3000.0,"data structures, sortings"
773,D,Perishable Roads,2700.0,"dp, graphs, shortest paths"
773,C,Prairie Partition,2200.0,"binary search, constructive algorithms, greedy, math"
773,B,Dynamic Problem Scoring,2000.0,"brute force, greedy"
773,A,Success Rate,1700.0,"binary search, math"
772,E,Verifying Kingdom,3200.0,"binary search, divide and conquer, interactive, trees"
772,D,Varying Kibibits,2700.0,"bitmasks, dp"
772,C,Vulnerable Kerbals,2300.0,"constructive algorithms, dp, graphs, math, number theory"
772,B,Volatile Kite,1800.0,geometry
772,A,Voltage Keepsake,1800.0,"binary search, math"
771,F,Bear and Isomorphic Points,3300.0,"geometry, two pointers"
771,E,Bear and Rectangle Strips,3000.0,"dp, greedy"
771,D,Bear and Company,2500.0,dp
771,C,Bear and Tree Jumps,2100.0,"dfs and similar, dp, trees"
771,B,Bear and Different Names,1500.0,"constructive algorithms, greedy"
771,A,Bear and Friendship Condition,1500.0,"dfs and similar, dsu, graphs"
770,D,Draw Brackets!,1400.0,"*special, implementation"
770,C,Online Courses In BSU,1500.0,"*special, dfs and similar, graphs, implementation"
770,B,Maximize Sum of Digits,1300.0,"*special, implementation, math"
770,A,New Password,800.0,"*special, implementation"
769,D,k-Interesting Pairs Of Integers,1700.0,"*special, bitmasks, brute force, meet-in-the-middle"
769,C,Cycle In Maze,1700.0,"*special, dfs and similar, graphs, greedy, shortest paths"
769,B,News About Credit,1200.0,"*special, greedy, two pointers"
769,A,Year of University Entrance,800.0,"*special, implementation, sortings"
768,G,The Winds of Winter,3300.0,"binary search, data structures"
768,F,Barrels and boxes,2300.0,"brute force, combinatorics, math, number theory, probabilities"
768,E,Game of Stones,2100.0,"bitmasks, dp, games"
768,D,Jon and Orbs,2200.0,"dp, math, probabilities"
768,C,Jon Snow and his Favourite Number,1800.0,"brute force, dp, implementation, sortings"
768,B,Code For 1,1600.0,"constructive algorithms, dfs and similar, divide and conquer"
768,A,Oath of the Night's Watch,900.0,"constructive algorithms, sortings"
767,E,Change-free,2400.0,greedy
767,D,Cartons of milk,2100.0,"binary search, data structures, greedy, sortings, two pointers"
767,C,Garland,2000.0,"dfs and similar, graphs, greedy, trees"
767,B,The Queue,2100.0,"brute force, greedy"
767,A,Snacktower,1100.0,"data structures, implementation"
766,E,Mahmoud and a xor trip,2100.0,"bitmasks, constructive algorithms, data structures, dfs and similar, dp, math, trees"
766,D,Mahmoud and a Dictionary,2000.0,"data structures, dfs and similar, dp, dsu, graphs"
766,C,Mahmoud and a Message,1700.0,"brute force, dp, greedy, strings"
766,B,Mahmoud and a Triangle,1000.0,"constructive algorithms, geometry, greedy, math, number theory, sortings"
766,A,Mahmoud and Longest Uncommon Subsequence,1000.0,"constructive algorithms, strings"
765,G,"Math, math everywhere",3200.0,"brute force, dp, math, meet-in-the-middle, number theory"
765,F,Souvenirs,3100.0,data structures
765,E,Tree Folding,2200.0,"dfs and similar, dp, greedy, implementation, trees"
765,D,Artsem and Saunders,1700.0,"constructive algorithms, dsu, math"
765,C,Table Tennis Game 2,1200.0,math
765,B,Code obfuscation,1100.0,"greedy, implementation, strings"
765,A,Neverending competitions,900.0,"implementation, math"
764,B,Timofey and cubes,900.0,"constructive algorithms, implementation"
764,A,Taymyr is calling you,800.0,"brute force, implementation, math"
763,E,Timofey and our friends animals,2900.0,"data structures, divide and conquer, dsu"
763,D,Timofey and a flat tree,2900.0,"data structures, graphs, hashing, shortest paths, trees"
763,C,Timofey and remoduling,2600.0,"brute force, implementation, math, number theory"
763,B,Timofey and rectangles,2100.0,"constructive algorithms, geometry"
763,A,Timofey and a tree,1600.0,"dfs and similar, dp, dsu, graphs, implementation, trees"
762,F,Tree nesting,2800.0,"combinatorics, graphs, trees"
762,E,Radio stations,2200.0,"binary search, data structures"
762,D,Maximum path,2300.0,"dp, greedy, implementation"
762,C,Two strings,2100.0,"binary search, hashing, strings, two pointers"
762,B,USB vs. PS/2,1400.0,"greedy, implementation, sortings, two pointers"
762,A,k-th divisor,1400.0,"math, number theory"
761,F,Dasha and Photos,2600.0,"brute force, data structures, dp, implementation"
761,E,Dasha and Puzzle,2000.0,"constructive algorithms, dfs and similar, graphs, greedy, trees"
761,D,Dasha and Very Difficult Problem,1700.0,"binary search, brute force, constructive algorithms, greedy, sortings"
761,C,Dasha and Password,1500.0,"brute force, dp, implementation"
761,B,Dasha and friends,1300.0,"brute force, implementation, math"
761,A,Dasha and Stairs,1000.0,"brute force, constructive algorithms, implementation, math"
760,B,Frodo and pillows,1500.0,"binary search, greedy"
760,A,Petr and a calendar,800.0,"implementation, math"
758,F,Geometrical Progression,2400.0,"brute force, math, number theory"
758,E,Broken Tree,2600.0,"dfs and similar, dp, graphs, greedy, trees"
758,D,Ability To Convert,2000.0,"constructive algorithms, dp, greedy, math, strings"
758,C,Unfair Poll,1700.0,"binary search, constructive algorithms, implementation, math"
758,B,Blown Garland,1100.0,"brute force, implementation, number theory"
758,A,Holiday Of Equality,800.0,"implementation, math"
757,G,Can Bash Save the Day?,3400.0,"data structures, divide and conquer, graphs, trees"
757,F,Team Rocket Rises Again,2800.0,"data structures, graphs, shortest paths"
757,E,Bash Plays with Functions,2500.0,"brute force, combinatorics, dp, number theory"
757,D,Felicity's Big Secret Revealed,2200.0,"bitmasks, dp"
757,C,Felicity is Coming!,1900.0,"data structures, hashing, sortings, strings"
757,B,Bash's Big Day,1400.0,"greedy, math, number theory"
757,A,Gotta Catch Em' All!,1000.0,implementation
756,F,Long number,3400.0,"expression parsing, math, number theory"
756,E,Byteland coins,3200.0,"combinatorics, dp, math"
756,D,Bacterial Melee,2400.0,"brute force, combinatorics, dp, string suffix structures"
756,C,Nikita and stack,2200.0,data structures
756,B,Travel Card,1600.0,"binary search, dp"
756,A,Pavel and barbecue,1700.0,"constructive algorithms, dfs and similar"
755,G,PolandBall and Many Other Balls,3200.0,"combinatorics, divide and conquer, dp, fft, math, number theory"
755,F,PolandBall and Gifts,2600.0,"bitmasks, dp, greedy"
755,E,PolandBall and White-Red graph,2400.0,"constructive algorithms, graphs, shortest paths"
755,D,PolandBall and Polygon,2000.0,data structures
755,C,PolandBall and Forest,1300.0,"dfs and similar, dsu, graphs, interactive, trees"
755,B,PolandBall and Game,1100.0,"binary search, data structures, games, greedy, sortings, strings"
755,A,PolandBall and Hypothesis,800.0,"brute force, graphs, math, number theory"
754,E,Dasha and cyclic table,2600.0,"bitmasks, brute force, fft, strings, trees"
754,D,Fedor and coupons,2100.0,"binary search, data structures, greedy, sortings"
754,C,Vladik and chat,2200.0,"brute force, constructive algorithms, dp, implementation, strings"
754,B,Ilya and tic-tac-toe game,1100.0,"brute force, implementation"
754,A,Lesha and array splitting,1200.0,"constructive algorithms, greedy, implementation"
753,C,Interactive Bulls and Cows (Hard),2500.0,"brute force, constructive algorithms, interactive"
753,B,Interactive Bulls and Cows (Easy),1600.0,"brute force, constructive algorithms, implementation"
753,A,Santa Claus and Candies,1000.0,"dp, greedy, math"
750,H,New Year and Snowy Grid,3500.0,"dfs and similar, dsu, graphs, interactive"
750,G,New Year and Binary Tree Paths,3200.0,"bitmasks, brute force, combinatorics, dp"
750,F,New Year and Finding Roots,2800.0,"constructive algorithms, implementation, interactive, trees"
750,E,New Year and Old Subsequence,2600.0,"data structures, divide and conquer, dp, matrices"
750,D,New Year and Fireworks,1900.0,"brute force, data structures, dfs and similar, dp, implementation"
750,C,New Year and Rating,1600.0,"binary search, greedy, math"
750,B,New Year and North Pole,1300.0,"geometry, implementation"
750,A,New Year and Hurry,800.0,"binary search, brute force, implementation, math"
749,E,Inversions After Shuffle,2400.0,"data structures, probabilities"
749,D,Leaving Auction,2000.0,"binary search, data structures"
749,C,Voting,1500.0,"greedy, implementation, two pointers"
749,B,Parallelogram is Back,1200.0,"brute force, constructive algorithms, geometry"
749,A,Bachgold Problem,800.0,"greedy, implementation, math, number theory"
748,F,Santa Clauses and a Soccer Championship,2300.0,"constructive algorithms, dfs and similar, graphs, trees"
748,E,Santa Claus and Tangerines,2100.0,"binary search, data structures, greedy, two pointers"
748,D,Santa Claus and a Palindrome,2100.0,"constructive algorithms, data structures, greedy"
748,C,Santa Claus and Robot,1400.0,"constructive algorithms, math"
748,B,Santa Claus and Keyboard Check,1500.0,"implementation, strings"
748,A,Santa Claus and a Place in a Class,800.0,"implementation, math"
747,F,Igor and Interesting Numbers,2500.0,"brute force, combinatorics, dp, math"
747,E,Comments,1700.0,"dfs and similar, expression parsing, implementation, strings"
747,D,Winter Is Coming,1800.0,"dp, greedy, sortings"
747,C,Servers,1300.0,implementation
747,B,Mammoth's Genome Decoding,900.0,"implementation, strings"
747,A,Display Size,800.0,"brute force, math"
746,G,New Roads,2100.0,"constructive algorithms, graphs, trees"
746,F,Music in Car,2200.0,"data structures, greedy, two pointers"
746,E,Numbers Exchange,1900.0,"greedy, implementation, math"
746,D,Green and Black Tea,1500.0,"constructive algorithms, greedy, math"
746,C,Tram,1600.0,"constructive algorithms, implementation, math"
746,B,Decoding,900.0,"implementation, strings"
746,A,Compote,800.0,"implementation, math"
745,B,Hongcow Solves A Puzzle,1400.0,implementation
745,A,Hongcow Learns the Cyclic Shift,900.0,"implementation, strings"
744,E,Hongcow Masters the Cyclic Shift,3200.0,"strings, two pointers"
744,D,Hongcow Draws a Circle,3200.0,geometry
744,C,Hongcow Buys a Deck of Cards,2400.0,"bitmasks, brute force, dp"
744,B,Hongcow's Game,1900.0,"bitmasks, divide and conquer, interactive"
744,A,Hongcow Builds A Nation,1500.0,"dfs and similar, graphs"
743,E,Vladik and cards,2200.0,"binary search, bitmasks, brute force, dp"
743,D,Chloe and pleasant prizes,1800.0,"dfs and similar, dp, graphs, trees"
743,C,Vladik and fractions,1500.0,"brute force, constructive algorithms, math, number theory"
743,B,Chloe and the sequence ,1200.0,"binary search, bitmasks, constructive algorithms, implementation"
743,A,Vladik and flights,1200.0,"constructive algorithms, greedy, implementation"
742,B,Arpa’s obvious problem and Mehrdad’s terrible solution,1500.0,"brute force, math, number theory"
742,A,Arpa’s hard exam and Mehrdad’s naive cheat,1000.0,"implementation, math, number theory"
741,E,Arpa’s abnormal DNA and Mehrdad’s deep interest,3400.0,"data structures, string suffix structures"
741,D,Arpa’s letter-marked tree and Mehrdad’s Dokhtar-kosh paths,2900.0,"data structures, dfs and similar, trees"
741,C,Arpa’s overnight party and Mehrdad’s silent entering,2600.0,"constructive algorithms, dfs and similar, graphs"
741,B,Arpa's weak amphitheater and Mehrdad's valuable Hoses,1600.0,"dfs and similar, dp, dsu"
741,A,Arpa's loud Owf and Mehrdad's evil plan,1600.0,"dfs and similar, math"
740,B,Alyona and flowers,1200.0,constructive algorithms
740,A,Alyona and copybooks,1300.0,"brute force, implementation"
739,E,Gosha is hunting,3000.0,"brute force, data structures, dp, flows, math, probabilities, sortings"
739,D,Recover a functional graph,3400.0,graph matchings
739,C,Alyona and towers,2500.0,data structures
739,B,Alyona and a tree,1900.0,"binary search, data structures, dfs and similar, graphs, trees"
739,A,Alyona and mex,1700.0,"constructive algorithms, greedy"
737,F,Dirty plates,3300.0,"constructive algorithms, math"
737,E,Tanya is 5!,3300.0,"graph matchings, graphs, greedy, schedules"
736,E,Chess Championship,2900.0,"constructive algorithms, flows, greedy, math"
736,D,Permutations,2800.0,"math, matrices"
735,E,Ostap and Tree,2500.0,"dp, trees"
735,D,Taxes,1600.0,"math, number theory"
735,C,Tennis Championship,1600.0,"combinatorics, constructive algorithms, greedy, math"
735,B,Urbanization,1100.0,"greedy, number theory, sortings"
735,A,Ostap and Grasshopper,800.0,"implementation, strings"
734,F,Anton and School,2500.0,"bitmasks, constructive algorithms, implementation, math"
734,E,Anton and Tree,2100.0,"dfs and similar, dp, trees"
734,D,Anton and Chess,1700.0,implementation
734,C,Anton and Making Potions,1600.0,"binary search, dp, greedy, two pointers"
734,B,Anton and Digits,800.0,"brute force, greedy, implementation, math"
734,A,Anton and Danik,800.0,"implementation, strings"
733,F,Drivers Dissatisfaction,2200.0,"data structures, dsu, graphs, trees"
733,E,Sleep in Class,2400.0,"constructive algorithms, data structures, math, two pointers"
733,D,Kostya the Sculptor,1600.0,"data structures, hashing"
733,C,Epidemic in Monstropolis,1800.0,"constructive algorithms, dp, greedy, two pointers"
733,B,Parade,1100.0,math
733,A,Grasshopper And the String,1000.0,implementation
732,F,Tourist Reform,2300.0,"dfs and similar, graphs"
732,E,Sockets,2100.0,"greedy, sortings"
732,D,Exams,1700.0,"binary search, greedy, sortings"
732,C,Sanatorium,1200.0,"binary search, constructive algorithms, greedy, implementation, math"
732,B,Cormen --- The Best Friend Of a Man,1000.0,"dp, greedy"
732,A,Buy a Shovel,800.0,"brute force, constructive algorithms, implementation, math"
731,F,Video Cards,1900.0,"brute force, data structures, implementation, math, number theory"
731,E,Funny Game,2200.0,"dp, games"
731,D,80-th Level Archeology,2200.0,"brute force, data structures, greedy, sortings"
731,C,Socks,1600.0,"dfs and similar, dsu, graphs, greedy"
