contestId,index,name,rating,tags
1859,B,Olya and Game with Arrays,1000.0,"constructive algorithms, greedy, math, sortings"
1859,A,United We Stand,800.0,"constructive algorithms, math, number theory"
1858,E2,Rollbacks (Hard Version),2600.0,"data structures, interactive, trees"
1858,E1,Rollbacks (Easy Version),2500.0,"brute force, data structures, dfs and similar, trees"
1858,D,Trees and Segments,2200.0,"brute force, data structures, dp, greedy, two pointers"
1858,C,Yet Another Permutation Problem,1000.0,"constructive algorithms, greedy, math, number theory"
1858,B,The Walkway,1500.0,"brute force, dp, greedy, math, number theory"
1858,A,Buttons,800.0,"games, greedy, math"
1857,G,Counting Graphs,2000.0,"combinatorics, divide and conquer, dsu, graphs, greedy, sortings, trees"
1857,F,Sum and Product,1600.0,"binary search, data structures, math"
1857,E,Power of Points,1500.0,"math, sortings"
1857,D,Strong Vertices,1300.0,"math, sortings, trees"
1857,C,Assembly via Minimums,1200.0,"greedy, sortings"
1857,B,Maximum Rounding,1100.0,"greedy, implementation, math"
1857,A,Array Coloring,800.0,"greedy, math"
1856,E2,PermuTree (hard version),2700.0,"bitmasks, dfs and similar, dp, fft, greedy, implementation, math, trees"
1856,E1,PermuTree (easy version),1800.0,"dfs and similar, dp, trees"
1856,D,More Wrong,2100.0,"divide and conquer, interactive"
1856,C,To Become Max,1600.0,"binary search, brute force, data structures, dp"
1856,B,Good Arrays,900.0,"implementation, math"
1856,A,Tales of a Sort,800.0,implementation
1855,B,Longest Divisors Interval,900.0,"brute force, combinatorics, greedy, math, number theory"
1855,A,Dalton the Teacher,800.0,"greedy, math"
1854,F,Mark and Spaceship,3500.0,"brute force, dp"
1854,E,Game Bundles,3000.0,"brute force, constructive algorithms, dp, greedy, math"
1854,D,Michael and Hotel,3000.0,"binary search, interactive, trees"
1854,C,Expected Destruction,2500.0,"combinatorics, dp, math, probabilities"
1854,B,Earn or Unlock,2200.0,"bitmasks, brute force, dp"
1854,A2,Dual (Hard Version),1900.0,"constructive algorithms, math"
1854,A1,Dual (Easy Version),1400.0,"constructive algorithms, math"
1853,B,Fibonaccharsis,1200.0,"binary search, brute force, math"
1853,A,Desorting,800.0,"brute force, greedy, math"
1852,F,Panda Meetups,3500.0,"data structures, dp, flows"
1852,E,Rivalries,3400.0,"constructive algorithms, data structures, greedy"
1852,D,Miriany and Matchstick,2800.0,"constructive algorithms, dp, greedy"
1852,C,Ina of the Mountain,2400.0,"data structures, dp, greedy, math"
1852,B,Imbalanced Arrays,1800.0,"constructive algorithms, graphs, greedy, math, sortings, two pointers"
1852,A,Ntarsis' Set,1800.0,"binary search, math, number theory"
1851,G,Vlad and the Mountains,2000.0,"binary search, data structures, dsu, graphs, implementation, sortings, trees, two pointers"
1851,F,Lisa and the Martians,1800.0,"bitmasks, greedy, math, strings, trees"
1851,E,Nastya and Potions,1500.0,"dfs and similar, dp, graphs, sortings"
1851,D,Prefix Permutation Sums,1300.0,"implementation, math"
1851,C,Tiles Comeback,1000.0,greedy
1851,B,Parity Sort,800.0,"greedy, sortings, two pointers"
1851,A,Escalator Conversations,800.0,"brute force, constructive algorithms, math"
1850,H,The Third Letter,1700.0,"dfs and similar, dsu, graphs, greedy, implementation"
1850,G,The Morning Star,1500.0,"combinatorics, data structures, geometry, implementation, math, sortings"
1850,F,We Were Both Children,1300.0,"brute force, implementation, math, number theory"
1850,E,Cardboard for Pictures,1100.0,"binary search, geometry, implementation, math"
1850,D,Balanced Round,900.0,"brute force, greedy, implementation, sortings"
1850,C,Word on the Paper,800.0,"implementation, strings"
1850,B,Ten Words of Wisdom,800.0,"implementation, sortings"
1850,A,To My Critics,800.0,"implementation, sortings"
1849,F,XOR Partition,2700.0,"binary search, bitmasks, data structures, divide and conquer, greedy, trees"
1849,E,Max to the Right of Min,2300.0,"binary search, data structures, divide and conquer, dp, dsu, two pointers"
1849,D,Array Painting,1700.0,"constructive algorithms, greedy, two pointers"
1849,C,Binary String Copying,1600.0,"binary search, brute force, data structures, hashing, strings"
1849,B,Monsters,1000.0,"greedy, math, sortings"
1849,A,Morning Sandwich,800.0,"implementation, math"
1848,F,Vika and Wiki,2400.0,"binary search, bitmasks, combinatorics, divide and conquer, dp, math"
1848,E,Vika and Stone Skipping,2600.0,"brute force, implementation, math, number theory"
1848,D,Vika and Bonuses,2200.0,"binary search, brute force, math, ternary search"
1848,C,Vika and Price Tags,1800.0,"math, number theory"
1848,B,Vika and the Bridge,1200.0,"binary search, data structures, greedy, implementation, math, sortings"
1848,A,Vika and Her Friends,900.0,"games, math"
1847,F,The Boss's Identity,2500.0,"binary search, bitmasks, data structures, dfs and similar, greedy, math, sortings"
1847,E,Triangle Platinum?,2900.0,"brute force, combinatorics, implementation, interactive, math, probabilities"
1847,D,Professor Higashikata,1900.0,"data structures, dsu, greedy, implementation, strings"
1847,C,"Vampiric Powers, anyone?",1400.0,"bitmasks, brute force, dp, greedy"
1847,B,Hamon Odyssey,1000.0,"bitmasks, greedy, two pointers"
1847,A,The Man who became a God ,800.0,"greedy, sortings"
1846,G,Rudolf and CodeVid-23,1900.0,"bitmasks, dp, graphs, greedy, shortest paths"
1846,F,Rudolph and Mimic,1800.0,"constructive algorithms, implementation, interactive"
1846,E2,Rudolf and Snowflakes (hard version),1800.0,"binary search, brute force, implementation, math"
1846,E1,Rudolf and Snowflakes (simple version),1300.0,"brute force, implementation, math"
1846,D,Rudolph and Christmas Tree,1200.0,"constructive algorithms, geometry, math"
1846,C,Rudolf and the Another Competition,1200.0,"constructive algorithms, data structures, dp, greedy, sortings"
1846,B,Rudolph and Tic-Tac-Toe,800.0,"brute force, implementation, strings"
1846,A,Rudolph and Cut the Rope ,800.0,"implementation, math"
1845,F,Swimmers in the Pool,2800.0,"dp, fft, math, number theory"
1845,E,Boxes and Balls,2500.0,"dp, implementation, math"
1845,D,Rating System,1800.0,"binary search, brute force, data structures, dp, dsu, greedy, math, two pointers"
1845,C,Strong Password,1400.0,"binary search, dp, greedy, strings"
1845,B,Come Together,900.0,"geometry, implementation, math"
1845,A,Forbidden Integer,800.0,"constructive algorithms, implementation, math, number theory"
1844,H,Multiple of Three Cycles,3400.0,"combinatorics, data structures, dp, dsu, math"
1844,G,Tree Weights,3000.0,"bitmasks, constructive algorithms, data structures, dfs and similar, implementation, math, matrices, number theory, trees"
1844,F2,Min Cost Permutation (Hard Version),2800.0,"binary search, constructive algorithms, data structures, greedy, math, sortings"
1844,F1,Min Cost Permutation (Easy Version),2600.0,"brute force, constructive algorithms, greedy, math"
1844,E,Great Grids,2400.0,"2-sat, constructive algorithms, dfs and similar, dsu, graphs"
1844,D,Row Major,1400.0,"constructive algorithms, greedy, math, number theory, strings"
1844,C,Particles,1300.0,"dp, greedy, implementation, math"
1844,B,Permutations & Primes,1000.0,"constructive algorithms, math"
1844,A,Subtraction Game,800.0,"constructive algorithms, games"
1843,F2,Omsk Metro (hard version),2300.0,"data structures, dfs and similar, divide and conquer, dp, math, trees"
1843,F1,Omsk Metro (simple version),1800.0,"data structures, dfs and similar, dp, graphs, greedy, math, trees"
1843,E,Tracking Segments,1600.0,"binary search, brute force, data structures, two pointers"
1843,D,Apple Tree,1200.0,"combinatorics, dfs and similar, dp, math, trees"
1843,C,Sum in Binary Tree,800.0,"bitmasks, combinatorics, math, trees"
1843,B,Long Long,800.0,"greedy, math, two pointers"
1843,A,Sasha and Array Coloring,800.0,"greedy, sortings, two pointers"
1842,I,Tenzing and Necklace,3500.0,"divide and conquer, dp, greedy"
1842,H,Tenzing and Random Real Numbers,3000.0,"bitmasks, dp, graphs, math, probabilities"
1842,G,Tenzing and Random Operations,2800.0,"combinatorics, dp, math, probabilities"
1842,F,Tenzing and Tree,2500.0,"dfs and similar, greedy, shortest paths, sortings, trees"
1842,E,Tenzing and Triangle,2300.0,"data structures, dp, geometry, greedy, math"
1842,D,Tenzing and His Animal Friends ,1900.0,"constructive algorithms, graphs, greedy"
1842,C,Tenzing and Balls,1500.0,dp
1842,B,Tenzing and Books,1100.0,"bitmasks, greedy, math"
1842,A,Tenzing and Tsondu,800.0,"games, math"
1841,F,Monocarp and a Strategic Game,2700.0,"geometry, sortings, two pointers"
1841,E,Fill the Matrix,2200.0,"data structures, greedy, math"
1841,D,Pairs of Segments,2000.0,"data structures, greedy, sortings, two pointers"
1841,C,Ranom Numbers,1800.0,"brute force, dp, greedy, math, strings"
1841,B,Keep it Beautiful,1000.0,implementation
1841,A,Game with Board,800.0,"constructive algorithms, games"
1840,G2,In Search of Truth (Hard Version),2500.0,"constructive algorithms, interactive, math, meet-in-the-middle, probabilities"
1840,G1,In Search of Truth (Easy Version),2200.0,"constructive algorithms, interactive, math, meet-in-the-middle, probabilities"
1840,F,Railguns,2200.0,"brute force, dfs and similar, dp, graphs"
1840,E,Character Blocking,1600.0,"data structures, hashing, implementation"
1840,D,Wooden Toy Festival,1400.0,"binary search, greedy, sortings"
1840,C,Ski Resort,1000.0,"combinatorics, math, two pointers"
1840,B,Binary Cafe,1100.0,"bitmasks, combinatorics, math"
1840,A,Cipher Shifer,800.0,"implementation, strings, two pointers"
1839,E,Decreasing Game,2400.0,"constructive algorithms, dfs and similar, dp, greedy, interactive"
1839,D,Ball Sorting,2100.0,"data structures, dp, sortings"
1839,C,Insert Zero and Invert Prefix,1300.0,constructive algorithms
1839,B,Lamps,1100.0,"greedy, sortings"
1839,A,The Good Array,800.0,"greedy, implementation, math"
1838,F,Stuck Conveyor,3000.0,"binary search, constructive algorithms, interactive"
1838,E,Count Supersequences,2500.0,"combinatorics, dp, math"
1838,D,Bracket Walk,2100.0,"data structures, greedy, strings"
1838,C,No Prime Differences,1400.0,"constructive algorithms, math, number theory"
1838,B,Minimize Permutation Subarrays,1100.0,"constructive algorithms, math"
1838,A,Blackboard List,800.0,"constructive algorithms, math"
1837,F,Editorial for Two,2400.0,"binary search, data structures, greedy, implementation"
1837,E,Playoff Fixing,2200.0,"combinatorics, trees"
1837,D,Bracket Coloring,1400.0,"constructive algorithms, greedy"
1837,C,Best Binary String,1000.0,"constructive algorithms, greedy"
1837,B,Comparison String,900.0,greedy
1837,A,Grasshopper on a Line,800.0,"constructive algorithms, math"
1836,B,Astrophysicists,1100.0,"greedy, math"
1836,A,Destroyer,800.0,"implementation, sortings"
1835,F,Good Graph,3500.0,"bitmasks, dfs and similar, graph matchings, graphs, implementation"
1835,E,Old Mobile,3500.0,"combinatorics, dp, probabilities"
1835,D,Doctor's Brown Hypothesis,2900.0,"dfs and similar, graphs, math, number theory"
1835,C,Twin Clusters,2600.0,"bitmasks, brute force, constructive algorithms, math, probabilities"
1835,B,Lottery,2500.0,"binary search, brute force, greedy, math, two pointers"
1835,A,k-th equality,1700.0,"brute force, implementation, math"
1834,F,Typewriter,2500.0,"brute force, math"
1834,E,MEX of LCM,2300.0,"binary search, data structures, implementation, math, number theory"
1834,D,Survey in Class,1900.0,"brute force, data structures, greedy, implementation, sortings"
1834,C,Game with Reversing,1200.0,"games, greedy, math, strings"
1834,B,Maximum Strength,1000.0,"greedy, math"
1834,A,Unit Array,800.0,"greedy, math"
1833,G,Ksyusha and Chinchilla,1800.0,"constructive algorithms, dfs and similar, dp, dsu, greedy, implementation, trees"
1833,F,Ira and Flamenco,1700.0,"combinatorics, constructive algorithms, data structures, implementation, math, sortings, two pointers"
1833,E,Round Dance,1600.0,"dfs and similar, dsu, graphs, shortest paths"
1833,D,Flipper,1400.0,"brute force, constructive algorithms, greedy"
1833,C,Vlad Building Beautiful Array,800.0,"greedy, math"
1833,B,Restore the Weather,900.0,"greedy, sortings"
1833,A,Musical Puzzle,800.0,"implementation, strings"
1832,F,Zombies,3200.0,"binary search, dp"
1832,E,Combinatorics Problem,2200.0,"brute force, combinatorics, dp"
1832,D2,Red-Blue Operations (Hard Version),2400.0,"binary search, constructive algorithms, greedy, implementation, math"
1832,D1,Red-Blue Operations (Easy Version),2100.0,"binary search, greedy, implementation, math"
1832,C,Contrast Value,1200.0,"greedy, implementation"
1832,B,Maximum Sum,1100.0,"brute force, sortings, two pointers"
1832,A,New Palindrome,800.0,strings
1831,B,Array merging,1000.0,"constructive algorithms, greedy"
1831,A,Twin Permutations,800.0,constructive algorithms
1830,F,The Third Grace,3200.0,"data structures, dp"
1830,E,Bully Sort,3500.0,"data structures, math"
1830,D,Mex Tree,2800.0,"brute force, dp, trees"
1830,C,Hyperregular Bracket Strings,2400.0,"combinatorics, greedy, hashing, math, number theory, sortings"
1830,B,The BOSS Can Count Pairs,2000.0,"brute force, math"
1830,A,Copil Copac Draws Trees,1400.0,"dfs and similar, dp, graphs, trees"
1829,H,Don't Blame Me,1700.0,"bitmasks, combinatorics, dp, math"
1829,G,Hits Different,1600.0,"data structures, dp, implementation, math"
1829,F,Forever Winter,1300.0,"dfs and similar, graphs, math"
1829,E,The Lakes,1100.0,"dfs and similar, dsu, graphs, implementation"
1829,D,Gold Rush,1000.0,"brute force, dfs and similar, dp, implementation"
1829,C,Mr. Perfectly Fine,800.0,"bitmasks, greedy, implementation"
1829,B,Blank Space,800.0,implementation
1829,A,Love Story,800.0,"implementation, strings"
1828,B,Permutation Swap,900.0,"math, number theory"
1828,A,Divisible Array,800.0,"constructive algorithms, math"
1827,F,Copium Permutation,3500.0,"constructive algorithms, data structures, greedy"
1827,E,Bus Routes,3400.0,"binary search, constructive algorithms, dfs and similar, greedy, trees"
1827,D,Two Centroids,2800.0,"data structures, dfs and similar, greedy, trees"
1827,C,Palindrome Partition,2600.0,"binary search, brute force, data structures, dp, hashing, strings"
1827,B2,Range Sorting (Hard Version),2400.0,"binary search, data structures, dp, greedy"
1827,B1,Range Sorting (Easy Version),2000.0,"binary search, dp, dsu, greedy, trees, two pointers"
1827,A,Counting Orders,1100.0,"combinatorics, math, sortings, two pointers"
1826,F,Fading into Fog,2800.0,"geometry, interactive, math, probabilities"
1826,E,Walk the Runway,2400.0,"bitmasks, brute force, data structures, dp, graphs, implementation, sortings"
1826,D,Running Miles,1700.0,"brute force, dp, greedy"
1826,C,Dreaming of Freedom,1300.0,"greedy, math, number theory"
1826,B,Lunatic Never Content,1100.0,"math, number theory"
1826,A,Trust Nobody,1200.0,"brute force, greedy, implementation, sortings"
1825,B,LuoTianyi and the Table,1000.0,"greedy, math"
1825,A,LuoTianyi and the Palindrome String,800.0,"greedy, strings"
1824,E,LuoTianyi and Cartridge,3500.0,"data structures, trees"
1824,D,LuoTianyi and the Function,3000.0,data structures
1824,C,LuoTianyi and XOR-Tree,2500.0,"data structures, dfs and similar, dp, dsu, greedy, trees"
1824,B2,LuoTianyi and the Floating Islands (Hard Version),2300.0,"combinatorics, dfs and similar, math, probabilities, trees"
1824,B1,LuoTianyi and the Floating Islands (Easy Version),1800.0,"combinatorics, math, probabilities, trees"
1824,A,LuoTianyi and the Show,1400.0,"greedy, implementation"
1823,F,Random Walk,2600.0,"dp, graphs, math, probabilities, trees"
1823,E,Removing Graph,2500.0,"brute force, dp, games, graphs, math"
1823,D,Unique Palindromes,1900.0,"constructive algorithms, math, strings"
1823,C,Strongly Composite,1300.0,"greedy, math, number theory"
1823,B,Sort with Step,900.0,"brute force, math, sortings"
1823,A,A-characteristic,800.0,"combinatorics, constructive algorithms, math"
1822,G2,Magic Triples (Hard Version),2200.0,"brute force, data structures, math, number theory"
1822,G1,Magic Triples (Easy Version),1700.0,"brute force, data structures, math, number theory"
1822,F,Gardening Friends,1700.0,"brute force, dfs and similar, dp, graphs, trees"
1822,E,Making Anti-Palindromes,1600.0,"greedy, math, strings"
1822,D,Super-Permutation,1200.0,"constructive algorithms, math"
1822,C,Bun Lover,800.0,math
1822,B,Karina and Array,800.0,"greedy, math, sortings"
1822,A,TubeTube Feed,800.0,"brute force, implementation"
1821,F,Timber,2600.0,"combinatorics, dp, fft, math"
1821,E,Rearrange Brackets,2100.0,"brute force, dp, greedy, sortings, strings"
1821,D,Black Cells,1900.0,"binary search, brute force, greedy, math"
1821,C,Tear It Apart,1300.0,"brute force, implementation, math, strings"
1821,B,Sort the Subarray,1100.0,"brute force, greedy"
1821,A,Matching,800.0,"combinatorics, math"
1820,B,JoJo's Incredible Adventures,1100.0,"math, strings, two pointers"
1820,A,Yura's New Name,800.0,"implementation, strings"
1819,F,"Willy-nilly, Crack, Into Release!",3500.0,"data structures, dp"
1819,E,Roads in E City,3200.0,"interactive, math, probabilities, trees"
1819,D,Misha and Apples,2800.0,"brute force, data structures, dp, two pointers"
1819,C,The Fox and the Complete Tree Traversal,2400.0,"constructive algorithms, dp, implementation, math, trees"
1819,B,The Butcher,1900.0,"geometry, greedy, implementation, sortings, two pointers"
1819,A,Constructive Problem,1300.0,"brute force, greedy"
1818,B,Indivisible,900.0,constructive algorithms
1818,A,Politics,800.0,"greedy, implementation"
1817,F,Entangled Substrings,3500.0,"string suffix structures, strings"
1817,E,Half-sum,3400.0,"brute force, divide and conquer, greedy"
1817,D,Toy Machine,2700.0,"constructive algorithms, games, implementation"
1817,C,Similar Polynomials,2400.0,"combinatorics, math"
1817,B,Fish Graph,1900.0,"brute force, constructive algorithms, dfs and similar, graphs"
1817,A,Almost Increasing Subsequence,1500.0,"binary search, data structures, greedy"
1816,B,Grid Reconstruction,1000.0,"constructive algorithms, greedy"
1816,A,Ian Visits Mary,800.0,"constructive algorithms, geometry, number theory"
1815,F,OH NO1 (-2-3-4),3500.0,"constructive algorithms, graphs, math"
1815,E,Bosco and Particle,3100.0,"dp, math, number theory, strings"
1815,D,XOR Counting,2600.0,"bitmasks, combinatorics, dp, math"
1815,C,Between,2200.0,"constructive algorithms, dfs and similar, graphs, greedy"
1815,B,Sum Graph,2000.0,"brute force, constructive algorithms, graphs, implementation, interactive, shortest paths, trees"
1815,A,Ian and Array Sorting,1300.0,"greedy, math"
1814,F,Communication Towers,2700.0,"brute force, divide and conquer, dsu"
1814,E,Chain Chips,2300.0,"data structures, dp, matrices"
1814,D,Balancing Weapons,2500.0,"binary search, brute force, data structures, math, two pointers"
1814,C,Search in Parallel,1500.0,"constructive algorithms, greedy, sortings"
1814,B,Long Legs,1700.0,"brute force, math"
1814,A,Coins,800.0,"implementation, math"
1812,J,Unmysterious Language,,"*special, constructive algorithms, strings"
1812,I,Mountain Climber,,*special
1812,H,Expected Twist,,"*special, interactive"
1812,G,Colour Vision,,"*special, implementation"
1812,F,Factorization,,"*special, number theory"
1812,E,Not a Geometry Problem,,"*special, constructive algorithms, geometry, math"
1812,D,Trivial Conjecture,,"*special, constructive algorithms, math, number theory"
1812,C,Digits,,*special
1812,B,Was it Rated?,,"*special, brute force, implementation"
1812,A,Are You a Robot?,,"*special, expression parsing, strings"
1811,G2,Vlad and the Nice Paths (hard version),2200.0,"binary search, combinatorics, data structures, dp, math, two pointers"
1811,G1,Vlad and the Nice Paths (easy version),2100.0,"combinatorics, dp, math"
1811,F,Is It Flower?,2100.0,"dfs and similar, graphs, implementation"
1811,E,Living Sequence,1500.0,"binary search, dp, math, number theory"
1811,D,Umka and a Long Flight,1600.0,"constructive algorithms, implementation, math"
1811,C,Restore the Array,1100.0,"constructive algorithms, greedy"
1811,B,Conveyor Belts,1000.0,"implementation, math"
1811,A,Insert Digit,800.0,"greedy, math, strings"
1810,H,Last Number,2900.0,"combinatorics, math"
1810,G,The Maximum Prefix,3200.0,dp
1810,F,M-tree,2800.0,"data structures, math, sortings, trees"
1810,E,Monsters,2100.0,"brute force, data structures, dfs and similar, dsu, graphs, greedy"
1810,D,Climbing the Tree,1700.0,"binary search, math"
1810,C,Make It Permutation,1300.0,"brute force, greedy, sortings"
1810,B,Candies,800.0,"constructive algorithms, math, number theory"
1810,A,Beautiful Sequence,800.0,"brute force, greedy"
1809,G,Prediction,2800.0,"combinatorics, dp, math"
1809,F,Traveling in Berland,2500.0,"binary search, data structures, graphs, greedy, implementation"
1809,E,Two Tanks,2400.0,"binary search, dp, implementation, math"
1809,D,Binary String Sorting,1800.0,"constructive algorithms, greedy"
1809,C,Sum on Subarrays,1500.0,"constructive algorithms, greedy, math"
1809,B,Points on Plane,1000.0,"binary search, greedy, math"
1809,A,Garland,800.0,implementation
1808,E3,Minibuses on Venus (hard version),2800.0,"brute force, combinatorics, dp, math"
1808,E2,Minibuses on Venus (medium version),2500.0,"combinatorics, divide and conquer, dp, matrices"
1808,E1,Minibuses on Venus (easy version),2200.0,"combinatorics, divide and conquer, dp"
1808,D,"Petya, Petya, Petr, and Palindromes",2100.0,"binary search, brute force, data structures, two pointers"
1808,C,Unlucky Numbers,1900.0,"brute force, dp, greedy, implementation"
1808,B,Playing in a Casino,1200.0,"math, sortings"
1808,A,Lucky Numbers,900.0,"brute force, implementation"
1807,G2,Subsequence Addition (Hard Version),1100.0,"bitmasks, dp, greedy, implementation, sortings"
1807,G1,Subsequence Addition (Easy Version),1100.0,"brute force, data structures, dp, greedy, implementation, sortings"
1807,F,Bouncy Ball,1700.0,"brute force, dfs and similar, implementation"
1807,E,Interview,1300.0,"binary search, implementation, interactive"
1807,D,Odd Queries,900.0,"data structures, implementation"
1807,C,Find and Replace,800.0,"greedy, implementation, strings"
1807,B,Grab the Candies,800.0,greedy
1807,A,Plus or Minus,800.0,implementation
1806,F2,GCD Master (hard version),2900.0,"greedy, math, sortings"
1806,F1,GCD Master (easy version),2900.0,"greedy, math, number theory, sortings"
1806,E,Tree Master,2200.0,"brute force, data structures, dfs and similar, trees"
1806,D,DSU Master,2500.0,"combinatorics, dp, dsu, math"
1806,C,Sequence Master,1600.0,"brute force, constructive algorithms, math"
1806,B,Mex Master,900.0,"constructive algorithms, greedy"
1806,A,Walking Master,800.0,"geometry, greedy, math"
1805,F2,Survival of the Weakest (hard version),3100.0,"greedy, math, sortings, two pointers"
1805,F1,Survival of the Weakest (easy version),2600.0,"binary search, brute force, implementation, math, sortings"
1805,E,There Should Be a Lot of Maximums,2300.0,"brute force, data structures, dfs and similar, dp, trees, two pointers"
1805,D,"A Wide, Wide Graph",1800.0,"dfs and similar, dp, graphs, greedy, trees"
1805,C,Place for a Selfie,1400.0,"binary search, data structures, geometry, math"
1805,B,The String Has a Target,800.0,"greedy, strings"
1805,A,We Need the Zero,800.0,"bitmasks, brute force"
1804,H,Code Lock,3300.0,"bitmasks, dp"
1804,G,Flow Control,3500.0,"data structures, dsu, implementation"
1804,F,Approximate Diameter,2700.0,"binary search, divide and conquer, graphs, shortest paths"
1804,E,Routing,2400.0,"bitmasks, brute force, dfs and similar, dp, graphs"
1804,D,Accommodation,2000.0,"brute force, dp, greedy, implementation"
1804,C,Pull Your Luck,1500.0,"brute force, greedy, math, number theory"
1804,B,Vaccination,1000.0,"greedy, implementation"
1804,A,Lame King,800.0,"greedy, math"
1802,B,Settlement of Guinea Pigs,1000.0,"greedy, implementation, math"
1802,A,Likes,800.0,"greedy, implementation"
1801,G,A task for substrings,3400.0,"data structures, string suffix structures, strings"
1801,F,Another n-dimensional chocolate bar,2700.0,"dp, math, meet-in-the-middle, number theory"
1801,E,Gasoline prices,3000.0,"data structures, divide and conquer, dsu, hashing, trees"
1801,D,The way home,2100.0,"binary search, data structures, dp, graphs, greedy, shortest paths, sortings"
1801,C,Music Festival,1900.0,"binary search, data structures, dp, greedy, sortings"
1801,B,Buying gifts,1800.0,"data structures, greedy, sortings"
1801,A,The Very Beautiful Blanket,1600.0,"bitmasks, constructive algorithms"
1800,G,Symmetree,2200.0,"dfs and similar, hashing, implementation, trees"
1800,F,Dasha and Nightmares,1900.0,"bitmasks, hashing, meet-in-the-middle, strings"
1800,E2,Unforgivable Curse (hard version),1500.0,"brute force, constructive algorithms, dfs and similar, dsu, graphs, greedy, strings"
1800,E1,Unforgivable Curse (easy version),1400.0,"brute force, constructive algorithms, dsu, graphs, greedy, strings"
1800,D,Remove Two Letters,1200.0,"data structures, greedy, hashing, strings"
1800,C2,Powering the Hero (hard version),1100.0,"data structures, greedy"
1800,C1,Powering the Hero (easy version),1000.0,"data structures, greedy"
1800,B,Count the Number of Pairs,1000.0,"greedy, strings"
1800,A,Is It a Cat?,800.0,"implementation, strings"
1799,H,Tree Cutting,3200.0,"bitmasks, dfs and similar, dp"
1799,G,Count Voting,2600.0,"combinatorics, dp, math"
1799,F,Halve or Subtract,2700.0,"binary search, brute force, dp, greedy, sortings"
1799,E,City Union,2300.0,"constructive algorithms, dfs and similar, dsu, geometry, greedy, implementation, math"
1799,D2,Hot Start Up (hard version),2100.0,"data structures, dp"
1799,D1,Hot Start Up (easy version),1900.0,dp
1799,C,Double Lexicographically Minimum,1700.0,"greedy, strings"
1799,B,Equalize by Divide,1200.0,"brute force, constructive algorithms, greedy, math"
1799,A,Recent Actions,800.0,"data structures, greedy, implementation, math"
1798,F,Gifts from Grandfather Ahmed,2500.0,"dp, math, number theory"
