contestId,index,name,rating,tags
2242,F,Summer Vacation,,"data structures, dp, probabilities"
2242,E,Product of Closures,,"bitmasks, brute force, constructive algorithms, greedy, implementation, math, number theory"
2242,D,Two Digit Strings,,"dp, strings"
2242,C,Unstable Elements,,"brute force, data structures, implementation, sortings, two pointers"
2242,B,Predominant Frequency Division,,"data structures, greedy, implementation, math"
2242,A,Bigrams,,"sortings, strings"
2241,G,Summmon,,"binary search, data structures, greedy, implementation, math, number theory"
2241,F,A Bit Odd,,"data structures, games, greedy, math"
2241,E,Fair and Square,,"combinatorics, dp, graphs, math, number theory, trees"
2241,D,An Alternative Way,,"dp, greedy, math"
2241,C,RemovevomeR,,greedy
2241,B,Good times Good times,,"constructive algorithms, dfs and similar, math"
2241,A,Divide and Conquer,,"greedy, math, number theory"
2240,B,AI Finds Nothing Here,1100.0,"combinatorics, math"
2240,A,Another Popcount Problem,800.0,greedy
2239,F,Colorful Works,3500.0,"dp, fft, games, implementation"
2239,E,"The end of this world,",3300.0,"data structures, divide and conquer, dsu, graphs"
2239,D,Hunting the Beast,2500.0,"combinatorics, dp, graphs, math"
2239,C,Revival,2200.0,"binary search, data structures, math, two pointers"
2239,B,Decidophobia,1500.0,"greedy, math, sortings, two pointers"
2239,A,Nim Game Is XOR Game,1300.0,"constructive algorithms, games, greedy, math"
2238,F,Infinite Work,2600.0,"combinatorics, graphs, greedy, math, trees"
2238,E,Cake Trial,2000.0,"dp, greedy"
2238,D,Storming Arasaka,1500.0,"greedy, math, number theory"
2238,C,Village Guilds,1400.0,"dfs and similar, dp, trees"
2238,B,Crimson Triples,900.0,"dp, math, number theory"
2238,A,Another Puzzle from Papyrus,800.0,"greedy, math, sortings"
2237,I2,DBFS Order (Hard Version),3500.0,"dp, trees"
2237,I1,DBFS Order (Easy Version),3500.0,"dp, trees"
2237,H,Slime and Queries,3500.0,"data structures, greedy, trees"
2237,G,Send GCDs,2900.0,"communication, constructive algorithms, interactive, math, number theory"
2237,F,Paint the Array,2400.0,"data structures, dp, greedy"
2237,E,Permutation Commutation,2000.0,"data structures, graphs, greedy"
2237,D,Fullmetal Bitchemist,1500.0,"constructive algorithms, greedy, math"
2237,C,Duck Surplus,1000.0,"binary search, greedy"
2237,B,Annoying the Ghost,1000.0,"brute force, greedy"
2237,A,Destroying Towers,800.0,"games, greedy, schedules"
2236,G,Criterion in Burlandia,2600.0,"binary search, bitmasks, brute force, data structures, dfs and similar, divide and conquer, implementation, trees, two pointers"
2236,F2,Elections in Saransk (hard version),2200.0,"combinatorics, dp, math, number theory"
2236,F1,Elections in Saransk (easy version),1700.0,number theory
2236,E,Friendly Gifts,1700.0,"brute force, dp"
2236,D,Brand New Tatar TV Show,1300.0,"binary search, constructive algorithms, dp, games, math"
2236,C,Omsk Programmers,1000.0,"brute force, greedy, math"
2236,B,Tatar TV Show,800.0,"greedy, math, strings"
2236,A,Games on the Train,800.0,"greedy, math"
2234,G,"Stripe, Token and Two Players",2700.0,"data structures, dp, games"
2234,F,"Vessels, Heights and Two Versions (Hard Version)",1900.0,"data structures, dfs and similar, dsu, greedy, implementation, two pointers"
2234,E,"Vlad, Misha and Two Arrays",2100.0,"brute force, combinatorics, dfs and similar, divide and conquer, math"
2234,D,"XOR, Expression and Two Binary Numbers",1500.0,"bitmasks, divide and conquer, dp, math, number theory"
2234,C,"Vessels, Heights and Two Versions (Easy Version)",1200.0,"dfs and similar, dsu, greedy, implementation, two pointers"
2234,B,"Palindrome, Twelve and Two Terms",800.0,"brute force, constructive algorithms, math"
2234,A,"Euclid, Sequence and Two Numbers",800.0,"math, number theory, sortings"
2233,F,Shortest GCD Paths,2800.0,"dp, graphs, math, number theory, shortest paths"
2233,E2,Permutation Transmission (Difficult Version),2300.0,"bitmasks, combinatorics, sortings"
2233,E1,Permutation Transmission (Easy Version),2200.0,"bitmasks, combinatorics, sortings"
2233,D,Goods on the Shelf,1900.0,"brute force, data structures, implementation, two pointers"
2233,C,Cost of a Bracket Sequence,1400.0,"brute force, dp, greedy"
2233,B,Different Distances,900.0,constructive algorithms
2233,A,AI Project Development,800.0,"brute force, math"
2232,F,The Cake Is a Lie,3000.0,"greedy, math, number theory"
2232,E,Snaking Arrangement,2600.0,"combinatorics, constructive algorithms"
2232,D,Magical Tiered Cake,2000.0,"constructive algorithms, dfs and similar, dp, greedy"
2232,C2,Seating Arrangement (Hard Version),1500.0,"binary search, greedy, math, two pointers"
2232,C1,Seating Arrangement (Easy Version),1300.0,"binary search, dp, greedy, two pointers"
2232,B,Cake Leveling,900.0,"binary search, greedy, math"
2232,A,Convergence,800.0,"greedy, sortings"
2231,F,Quadratic Jumps,2600.0,"brute force, constructive algorithms, greedy, math, number theory"
2231,E,Graph Cutting,2300.0,"dfs and similar, dp, math, trees"
2231,D,Maximum Prefix Sums,1900.0,"constructive algorithms, greedy, implementation, two pointers"
2231,C,Chipmunk Theo and Equality,1400.0,"implementation, sortings"
2231,B,Another Sorting Problem,1100.0,constructive algorithms
2231,A,Construct an Array,800.0,constructive algorithms
2230,F,Game on Growing Tree,2700.0,"binary search, dfs and similar, divide and conquer, dp, games, implementation, trees"
2230,E,Minimum Influence,2100.0,"binary search, data structures, greedy, implementation, math, sortings, two pointers"
2230,D,Good Schedule,1700.0,"dp, greedy"
2230,C,Arrange the Numbers in a Circle,1300.0,"constructive algorithms, implementation, math"
2230,B,Digit String,1000.0,"greedy, implementation, math"
2230,A,Optimal Purchase,800.0,"implementation, math"
2229,I,The Endians,3400.0,"dp, trees"
2229,H,Wowee Binary String,3200.0,"combinatorics, dp, strings"
2229,G,Roadworks,2900.0,"binary search, data structures, dp, greedy, two pointers"
2229,F,Load Unbalancing,2400.0,"binary search, bitmasks, dp, greedy"
2229,E,Deconstruction Tree,2100.0,"combinatorics, data structures, dp, graphs, trees"
2229,D,Me When Median Problem,1700.0,"binary search, greedy"
2229,C2,We Be Flipping (Hard Version),1400.0,"constructive algorithms, dp, greedy"
2229,C1,We Be Flipping (Easy Version),900.0,"constructive algorithms, greedy"
2229,B,Absolute Cinema,800.0,"greedy, math"
2229,A,Slimes on a Line,800.0,"brute force, greedy, math"
2228,F,Momoyo and the Network,2700.0,"binary search, dfs and similar, divide and conquer, dp, trees"
2228,E2,Amanojaku and Sequence (Hard Version),2500.0,"combinatorics, data structures, implementation, math"
2228,E1,Amanojaku and Sequence (Easy Version),2400.0,"combinatorics, math"
2228,D,"Sanae, Cross and Color",1900.0,"binary search, data structures, implementation"
2228,C2,Cirno and Number (Hard Version),1600.0,"binary search, dfs and similar, dp, greedy, implementation"
2228,C1,Cirno and Number (Easy Version),1500.0,"binary search, brute force, dp, greedy, implementation"
2228,B,Remilia Plays Soku,1100.0,"games, implementation"
2228,A,Marisa Steals Reimu's Takeout,800.0,"greedy, implementation"
2227,H,Fallen Leaves,2100.0,"dfs and similar, dp, trees"
2227,G,Drowning,2000.0,"binary search, data structures, math"
2227,F,It Just Keeps Going Sideways,1700.0,"binary search, data structures, dp, greedy, math"
2227,E,It All Went Sideways,1400.0,"binary search, data structures, dp, greedy"
2227,D,Palindromex,1200.0,"binary search, brute force, constructive algorithms, data structures, greedy, implementation, two pointers"
2227,C,Snowfall,800.0,"constructive algorithms, math"
2227,B,Party Monster,800.0,greedy
2227,A,Koshary,800.0,"implementation, math"
2226,G,Stop Spot,3000.0,"implementation, strings, trees"
2226,F,Inversion Invasion,2800.0,"math, number theory"
2226,E,Mental Monumental (Hard Version),2300.0,"data structures, greedy, math, two pointers"
2226,D,Reserved Reversals,1900.0,"constructive algorithms, dp, greedy, math"
2226,C,Mental Monumental (Easy Version),1500.0,"binary search, data structures, greedy, math, two pointers"
2226,B,Everything Everywhere,900.0,"greedy, math, number theory"
2226,A,Disturbing Distribution,800.0,"greedy, math"
2225,G,Simple Problem,2900.0,"brute force, graphs, greedy, number theory"
2225,F,String Cutting,2600.0,"binary search, brute force, greedy, hashing, string suffix structures, strings"
2225,E,Covering Points with Circles,2200.0,"constructive algorithms, geometry, math"
2225,D,Exceptional Segments,1500.0,"bitmasks, brute force, math"
2225,C,Red-Black Pairs,1100.0,"dp, greedy"
2225,B,Alternating String,900.0,"brute force, greedy"
2225,A,A Number Between Two Others,800.0,"greedy, math"
2224,B,Zhily and Mex and Max,1200.0,"constructive algorithms, greedy, math, sortings"
2224,A,Zhily and Array Operating,800.0,"constructive algorithms, greedy"
2223,F,Zhily and Colorful Strings,3400.0,"divide and conquer, fft, math"
2223,E,Zhily and Permutation,3500.0,"data structures, divide and conquer, trees"
2223,D,Zhily and Cycle,2800.0,"graphs, greedy"
2223,C,Zhily and Signpost,2300.0,"chinese remainder theorem, dfs and similar, math, number theory, trees"
2223,B,Zhily and Barknights,1600.0,"binary search, data structures, dp, math, sortings, two pointers"
2223,A,Zhily and Bracket Swapping,1300.0,"constructive algorithms, greedy"
2222,H,Counting Sort?,3500.0,"brute force, combinatorics, dp"
2222,G,Statistics on Tree,3100.0,"binary search, brute force, dfs and similar, divide and conquer, graphs, trees"
2222,F,Building Tree,2600.0,"data structures, divide and conquer, dsu, graphs, implementation"
2222,E,Seek the Truth,2000.0,"binary search, bitmasks, constructive algorithms, interactive"
2222,D,Permutation Construction,1800.0,"constructive algorithms, data structures, sortings"
2222,C,Median Partition,1500.0,"dp, math"
2222,B,Artistic Balance Tree,1100.0,"greedy, sortings"
2222,A,A Wonderful Contest,800.0,"brute force, dp, math"
2220,B,OIE Excursion,1200.0,greedy
2220,A,Blocked,800.0,"greedy, sortings"
2219,E,Weird Chessboard,3500.0,"constructive algorithms, math"
2219,D,MEX Replacement on Tree,2700.0,"data structures, implementation, math, trees"
2219,C,Coloring a Red Black Tree,2300.0,"dfs and similar, dp, greedy, math, probabilities, trees"
2219,B2,Unique Values (Hard version),2000.0,"binary search, bitmasks, constructive algorithms, interactive"
2219,B1,Unique Values (Easy version),1900.0,"binary search, constructive algorithms, divide and conquer, interactive, math"
2219,A,Grid L,1400.0,"brute force, constructive algorithms, math, number theory"
2218,G,"The 67th Iteration of ""Counting is Fun""",1800.0,"implementation, math"
2218,F,The 67th Tree Problem,1500.0,"constructive algorithms, implementation, trees"
2218,E,The 67th XOR Problem,1200.0,"binary search, bitmasks, brute force"
2218,D,The 67th OEIS Problem,1100.0,"constructive algorithms, greedy, math, number theory"
2218,C,The 67th Permutation Problem,800.0,"constructive algorithms, greedy, math"
2218,B,The 67th 6-7 Integer Problem,800.0,"greedy, math"
2218,A,The 67th Integer Problem,800.0,"brute force, games, implementation, math"
2217,H,Closer,2800.0,"dfs and similar, dp, trees"
2217,G,Down the Pivot,2600.0,"combinatorics, dp, math, trees"
2217,F,Interval Game,2300.0,"bitmasks, combinatorics, constructive algorithms, dp, games, greedy, math, probabilities"
2217,E,Definitely Larger,2000.0,"binary search, constructive algorithms, data structures, graphs, greedy, sortings"
2217,D,Flip the Bit (Hard Version),1900.0,"greedy, implementation, math"
2217,C,Grid Covering,1300.0,"chinese remainder theorem, math, number theory"
2217,B,Flip the Bit (Easy Version),1000.0,"greedy, implementation"
2217,A,The Equalizer,800.0,math
2216,B,THU Packing Puzzle,1300.0,greedy
2216,A,Course Wishes,900.0,greedy
2215,G,Maze,3500.0,trees
2215,F,Research,3500.0,games
2215,E,Star Map,2700.0,"constructive algorithms, data structures, geometry, greedy, sortings"
2215,D,"EXPloration, EXPloitation, and Gain Some EXPerience!",2800.0,"bitmasks, brute force, dp, greedy, implementation"
2215,C,Oriented Journey,2200.0,"bitmasks, brute force, communication, constructive algorithms, graphs, interactive, trees"
2215,B,RReeppeettiittiioonn,2000.0,"binary search, brute force, implementation, math, number theory"
2215,A,Interval Mod,1700.0,"constructive algorithms, dp, greedy, math"
2214,J,Special Problem,,"*special, brute force, games, interactive"
2214,I,You Are a Robot,,*special
2214,H,Double Vision,,*special
2214,G,Anomaly,,"*special, communication"
2214,F,Numbers,,*special
2214,E,Shortest Paths,,"*special, shortest paths"
2214,D,Neural Feud,,"*special, strings"
2214,C,And?,,"*special, bitmasks"
2214,B,Are You Smiling?,,"*special, strings"
2214,A,Odd One Out,,"*special, graph matchings, implementation"
2211,H,Median Deletion,3500.0,
2211,G,Rational Bubble Sort,2900.0,"constructive algorithms, geometry, greedy"
2211,F,Learning Binary Search,2400.0,"combinatorics, divide and conquer, dp, math"
2211,E,Minimum Path Cover,2500.0,"brute force, dp, greedy, interactive, math, number theory, trees"
2211,D,AND-array,1900.0,"bitmasks, combinatorics, math"
2211,C2,Equal Multisets (Hard Version),1800.0,"constructive algorithms, dsu, greedy"
2211,C1,Equal Multisets (Easy Version),1300.0,"binary search, brute force, greedy, two pointers"
2211,B,Mickey Mouse Constructive,1100.0,"constructive algorithms, dp, greedy, math"
2211,A,Antimedian Deletion,800.0,"implementation, math"
2210,F,A Simple Problem,2700.0,"binary search, data structures, greedy, math, trees"
2210,E,Binary Strings are Simple?,2700.0,"constructive algorithms, implementation, interactive, number theory"
2210,D,A Simple RBS Problem,2100.0,"constructive algorithms, math, strings, trees"
2210,C2,A Simple GCD Problem (Hard Version),2100.0,"dp, greedy, number theory"
2210,C1,A Simple GCD Problem (Easy Version),1200.0,"greedy, number theory"
2210,B,Simply Sitting on Chairs,900.0,"data structures, greedy"
2210,A,A Simple Sequence,800.0,"constructive algorithms, dp, greedy, number theory"
2209,F,Dynamic Values And Maximum Sum,2700.0,"data structures, greedy, implementation, trees"
2209,E,A Trivial String Problem,2200.0,"brute force, dp, hashing, string suffix structures, strings"
2209,D,Ghostfires,1800.0,"constructive algorithms, greedy"
2209,C,Find the Zero,1400.0,"constructive algorithms, interactive"
2209,B,Array,900.0,greedy
2209,A,Flip Flops,800.0,greedy
2208,E,Counting Cute Arrays,2700.0,"combinatorics, dp"
2208,D2,Tree Orientation (Hard Version),2200.0,"dfs and similar, dsu, graphs, greedy, sortings, trees"
2208,D1,Tree Orientation (Easy Version),1800.0,"constructive algorithms, dfs and similar, dsu, graphs, greedy, matrices, trees"
2208,C,Stamina and Tasks,1300.0,"dp, greedy, math"
2208,B,Cyclists,1100.0,"brute force, games, greedy, implementation, math, sortings"
2208,A,Bingo Candies,800.0,"constructive algorithms, math"
2207,H3,Bowser's Castle (Hard Version),,"constructive algorithms, divide and conquer, interactive, trees, two pointers"
2207,H2,Bowser's Castle (Medium Version),,"constructive algorithms, divide and conquer, interactive, trees, two pointers"
2207,H1,Bowser's Castle (Easy Version),,"binary search, constructive algorithms, divide and conquer, greedy, interactive, trees"
2207,G,Toothless,3300.0,"constructive algorithms, dfs and similar, dsu"
2207,F,Hanabi,2900.0,"binary search, data structures, dp, dsu, flows, graph matchings, graphs, greedy"
2207,E2,N-MEX (Counting Version),2400.0,"combinatorics, constructive algorithms, math"
2207,E1,N-MEX (Constructive Version),2100.0,"constructive algorithms, greedy"
2207,D,Boxed Like a Fish,2200.0,"dfs and similar, dp, games, shortest paths, trees"
2207,C,Where's My Water?,1600.0,"data structures, divide and conquer, dp, math"
2207,B,One Night At Freddy's,1600.0,"games, greedy, sortings"
2207,A,1-1,800.0,"greedy, strings"
2206,M,Deformed Balance,2900.0,
2206,L,Onion,3500.0,
2206,K,Time Display Stickers,1300.0,binary search
2206,J,Worldwide Playlist,1700.0,math
2206,I,Growth Factor,2900.0,"combinatorics, dp, math, number theory"
2206,H,Reflect Sort,1800.0,number theory
2206,G,Extra Transition,3100.0,graphs
2206,F,Minesweeper String,2400.0,"fft, number theory"
2206,E,Parallel Sums,2500.0,"data structures, geometry"
2206,D,Christmas Tree Un-decoration,2600.0,"data structures, dp, trees"
2206,C,Upside Down Dijkstra,2200.0,dfs and similar
2206,B,Subtree Removal Game,2500.0,"binary search, games, trees"
2206,A,Compare Suffixes,3500.0,interactive
2205,G,Simons and Diophantus Equation,3000.0,"bitmasks, brute force, data structures, math, number theory"
2205,F,Simons and Reconstructing His Roads,2400.0,"constructive algorithms, data structures, dsu, graphs"
2205,E,Simons and Dividing the Rhythm,2100.0,"combinatorics, data structures, dp, dsu, math, string suffix structures, strings"
2205,D,Simons and Beating Peaks,1700.0,"data structures, divide and conquer, dp, greedy, implementation, trees"
2205,C,Simons and Posting Blogs,1500.0,"greedy, sortings"
2205,B,Simons and Cakes for Success,800.0,"implementation, math"
2205,A,Simons and Making It Beautiful,800.0,"brute force, constructive algorithms"
2204,G,Grid Path,2700.0,"dp, graphs, matrices"
2204,F,Sum of Fractions,2200.0,"binary search, brute force, combinatorics, data structures, greedy, math, number theory, two pointers"
2204,E,Sum of Digits (and Again),1800.0,"brute force, constructive algorithms, math"
2204,D,Alternating Path,1400.0,"constructive algorithms, dfs and similar, graph matchings, graphs"
2204,C,Spring,1000.0,"math, number theory"
2204,B,Right Maximum,800.0,greedy
2204,A,Passing the Ball,800.0,"brute force, implementation"
2203,F,Binary Search with One Swap,2600.0,"binary search, divide and conquer, dp, hashing, math, two pointers"
2203,E,Probabilistic Card Game,2200.0,"binary search, data structures, games, greedy, math, ternary search"
2203,D,Divisibility Game,1700.0,"brute force, games, greedy, number theory"
2203,C,Test Generator,1500.0,"binary search, bitmasks, greedy, math"
2203,B,Beautiful Numbers,1000.0,"bitmasks, dp, fft, greedy, math"
2203,A,Towers of Boxes,800.0,math
2202,G1,Monotone Monochrome Matrices (Easy Version),2500.0,data structures
2202,B,ABAB Construction,1200.0,"dp, greedy, implementation"
2202,A,Parkour Design,800.0,math
2201,G,Codeforces Heuristic Contest 1001,3500.0,constructive algorithms
2201,F2,Monotone Monochrome Matrices (Hard Version),2800.0,"constructive algorithms, data structures, hashing, math"
2201,F1,Monotone Monochrome Matrices (Medium Version),2900.0,"data structures, hashing"
2201,E,ABBA Counting,2900.0,"fft, math, number theory, strings"
2201,D,Binary Not Search and Queries,2500.0,"data structures, greedy, implementation"
2201,C,Rigged Bracket Sequence,2000.0,"combinatorics, dp, greedy"
2201,B,Recollect Numbers,1700.0,constructive algorithms
2201,A2,Lost Civilization (Hard Version),1700.0,"data structures, dp"
2201,A1,Lost Civilization (Easy Version),1300.0,data structures
2200,H,Six Seven,2600.0,"divide and conquer, math, number theory, strings, trees"
2200,G,Operation Permutation,2200.0,"combinatorics, dp, math, probabilities"
2200,F,Mooclear Reactor 2,1900.0,"brute force, data structures, greedy, implementation, sortings"
2200,E,Divisive Battle,1500.0,"games, greedy, math, number theory"
2200,D,Portal,1300.0,"greedy, sortings"
2200,C,Specialty String,900.0,"brute force, greedy, strings"
2200,B,Deletion Sort,800.0,"bitmasks, brute force, greedy, sortings"
2200,A,Eating Game,800.0,greedy
2199,I,Strange Process,3000.0,*special
2199,H,Sum of MEX,2300.0,"*special, combinatorics, data structures, dp, math"
2199,G,Jammer,2500.0,"*special, math"
2199,F,Self-Produced Sequences,2000.0,"*special, combinatorics, math"
2199,E,Supersequence,2100.0,"*special, binary search, greedy"
2199,D,Two Arrays,1800.0,"*special, math"
2199,C,Minesweeper,1600.0,"*special, constructive algorithms, greedy"
2199,B,Two Towers,1400.0,"*special, greedy, math"
2199,A,Game,1000.0,*special
2197,B,Array and Permutation,1100.0,"implementation, schedules, sortings, two pointers"
2197,A,Friendly Numbers,800.0,"binary search, brute force, expression parsing, math, schedules"
2196,F,Indivisible,3300.0,"brute force, constructive algorithms, graphs"
2196,E2,Fuzzy Concatenation (Hard version),3000.0,"binary search, bitmasks, data structures, dp, greedy, string suffix structures"
2196,E1,Fuzzy Concatenation (Easy Version),2900.0,"binary search, bitmasks, brute force, data structures, greedy, string suffix structures"
2196,D,Double Bracket Sequence,2500.0,"data structures, dp, expression parsing, flows, greedy, strings"
2196,C2,Interactive Graph (Hard Version),2000.0,"combinatorics, dfs and similar, dp, graphs, interactive"
2196,C1,Interactive Graph (Simple Version),1800.0,"binary search, combinatorics, dfs and similar, dp, graphs, interactive"
2196,B,Another Problem about Beautiful Pairs,1600.0,"brute force, math, two pointers"
2196,A,Game with a Fraction,1200.0,"games, math"
2195,H,Codeforces Heuristic Contest 001,2400.0,"brute force, constructive algorithms, geometry, implementation"
2195,G,Idiot First Search and Queries,2300.0,"binary search, data structures, dp, graphs, trees"
2195,F,Parabola Independence,2000.0,"dp, graphs, greedy, math, sortings"
2195,E,Idiot First Search,1500.0,"dfs and similar, dp, trees"
2195,D,Absolute Cinema,1300.0,math
2195,C,Dice Roll Sequence,1100.0,"dp, greedy"
2195,B,Heapify 1,900.0,"implementation, sortings"
2195,A,Sieve of Erato67henes,800.0,"math, number theory"
2194,F2,Again Trees... (hard version),3000.0,"bitmasks, data structures, dfs and similar, dp, fft, trees"
2194,F1,Again Trees... (Easy Version),2300.0,"bitmasks, dfs and similar, dp, trees"
2194,E,The Turtle Strikes Back,2000.0,"dp, graphs, greedy, implementation"
2194,D,Table Cut,1600.0,"constructive algorithms, greedy, implementation"
2194,C,Secret message,1300.0,"bitmasks, brute force, dp, math, number theory"
2194,B,Offshores,1000.0,"greedy, implementation, math"
2194,A,Lawn Mower,800.0,"greedy, math"
2193,H,Remove the Grail Tree,2400.0,"dfs and similar, dp, graphs, greedy, implementation, trees"
2193,G,Paths in a Tree,2100.0,"dfs and similar, interactive, sortings, trees"
2193,F,Pizza Delivery,1600.0,"dp, greedy"
2193,E,Product Queries,1300.0,"dp, math, number theory, shortest paths"
2193,D,Monster Game,1100.0,"binary search, sortings, two pointers"
2193,C,Replace and Sum,1000.0,"data structures, greedy"
2193,B,Reverse a Permutation,800.0,greedy
2193,A,DBMB and the Array,800.0,"brute force, math"
2192,F,Fish Fight,2900.0,"dp, math, probabilities"
2192,E,Swap to Rearrange,2100.0,"constructive algorithms, dfs and similar, graph matchings, graphs, greedy, strings"
2192,D,Cost of Tree,1800.0,"dp, greedy, trees"
2192,C,All-in-one Gun,1300.0,"binary search, greedy, math"
2192,B,Flipping Binary String,1000.0,"constructive algorithms, strings"
2192,A,String Rotation Game,800.0,"brute force, strings"
2191,B,MEX Reordering,1000.0,"constructive algorithms, sortings"
2191,A,Array Coloring,800.0,constructive algorithms
2190,G,Maximize Determinant,3300.0,graphs
2190,F,Xor Product,3300.0,"bitmasks, dp"
2190,E,Median Permutation,3200.0,combinatorics
2190,D,Prufer Vertex,2500.0,"combinatorics, dsu, number theory, probabilities, trees"
2190,C,Comparable Permutations,2300.0,"greedy, implementation, interactive, sortings, two pointers"
2190,B2,Sub-RBS (Hard Version),1900.0,"dp, games, implementation, strings"
2190,B1,Sub-RBS (Easy Version),1400.0,"combinatorics, constructive algorithms, dp, greedy, strings, two pointers"
2190,A,Sorting Game,1200.0,"constructive algorithms, games, greedy"
2189,F,Zhora the Vacuum Cleaner,2800.0,"data structures, dfs and similar, dp, greedy, implementation, sortings, trees"
2189,E,Majority Wins?,2600.0,"constructive algorithms, greedy, math, strings"
2189,D2,Little String (Hard Version),2200.0,"combinatorics, dp, greedy, math, number theory"
2189,D1,Little String (Easy Version),1900.0,"combinatorics, dp, greedy, math, number theory"
2189,C2,XOR-convenience (Hard Version),1800.0,"bitmasks, constructive algorithms, math"
2189,C1,XOR Convenience (Easy Version),1300.0,"bitmasks, constructive algorithms, math"
2189,B,The Curse of the Frog,1200.0,"constructive algorithms, greedy, math"
2189,A,Table with Numbers,800.0,"greedy, implementation"
2188,B,Seats,1000.0,greedy
2188,A,Divisible Permutation,800.0,constructive algorithms
2187,G,Many Cartesian Trees,3500.0,"greedy, sortings, trees"
2187,F2,Al Fine (Counting Version),3500.0,"dp, trees"
2187,F1,Al Fine (Maximizing Version),3100.0,"binary search, data structures, divide and conquer, trees"
2187,E,Doors and Keys,3500.0,"brute force, data structures, dp"
2187,D,Cool Problem,2600.0,"bitmasks, dp, math"
2187,C,Jerry and Tom,2300.0,"data structures, dfs and similar, dsu, games, graphs, greedy, trees"
2187,B,Shortest Statement Ever,1800.0,"bitmasks, constructive algorithms, dp, greedy"
2187,A,Restricted Sorting,1300.0,"greedy, sortings"
2185,H,BattleCows 2,2500.0,"binary search, brute force, data structures, dp, greedy"
2185,G,Mixing MEXes,1800.0,"data structures, implementation, math"
2185,F,BattleCows,1700.0,"data structures, divide and conquer, implementation"
2185,E,The Robotic Rush,1500.0,"binary search, greedy, implementation, two pointers"
2185,D,OutOfMemoryError,1100.0,"data structures, implementation, math, two pointers"
2185,C,Shifted MEX,900.0,"implementation, sortings"
2185,B,Prefix Max,800.0,greedy
2185,A,Perfect Root,800.0,"constructive algorithms, math"
2184,G,Nastiness of Segments,1900.0,"binary search, data structures"
2184,F,Cherry Tree,1900.0,"dfs and similar, dp, graphs, trees"
2184,E,Exquisite Array,1800.0,"combinatorics, data structures, dsu, sortings"
2184,D,Unfair Game,1600.0,"combinatorics, dp, math"
2184,C,Huge Pile,1100.0,"binary search, dfs and similar, dp, graphs, math"
2184,B,Hourglass,1100.0,math
2184,A,Social Experiment,800.0,math
