contestId,index,name,rating,tags
1406,D,Three Sequences,2200.0,"constructive algorithms, data structures, greedy, math"
1406,C,Link Cut Centroids,1700.0,"constructive algorithms, dfs and similar, graphs, trees"
1406,B,Maximum Product,1200.0,"brute force, dp, greedy, implementation, sortings"
1406,A,Subset Mex,900.0,"greedy, implementation, math"
1405,B,Array Cancellation,1000.0,"constructive algorithms, implementation"
1405,A,Permutation Forgery,800.0,constructive algorithms
1404,E,Bricks,2800.0,"flows, graph matchings, graphs"
1404,D,Game of Pairs,2800.0,"constructive algorithms, dfs and similar, interactive, math, number theory"
1404,C,Fixed Point Removal,2300.0,"binary search, constructive algorithms, data structures, greedy, two pointers"
1404,B,Tree Tag,1900.0,"dfs and similar, dp, games, trees"
1404,A,Balanced Bitstring,1500.0,"implementation, strings"
1403,C,Chess Rush,3200.0,"*special, combinatorics, dp, implementation, math"
1403,B,Spring cleaning,2300.0,"*special, data structures, dfs and similar, graphs, trees"
1403,A,The Potion of Great Power,2400.0,"*special, 2-sat, binary search, data structures, graphs, interactive, sortings, two pointers"
1402,C,Star Trek,2600.0,"*special, combinatorics, dfs and similar, dp, games, graphs, matrices, trees"
1402,B,Roads,2900.0,"*special, geometry, sortings"
1402,A,Fancy Fence,1800.0,"*special, data structures, dsu, implementation, math, sortings"
1401,F,Reverse and Swap,2400.0,"binary search, bitmasks, data structures"
1401,E,Divide Square,2400.0,"data structures, geometry, implementation, sortings"
1401,D,Maximum Distributed Tree,1800.0,"dfs and similar, dp, greedy, implementation, math, number theory, sortings, trees"
1401,C,Mere Array,1300.0,"constructive algorithms, math, number theory, sortings"
1401,B,Ternary Sequence,1100.0,"constructive algorithms, greedy, math"
1401,A,Distance and Axis,900.0,"constructive algorithms, math"
1400,G,Mercenaries,2600.0,"bitmasks, brute force, combinatorics, dp, dsu, math, two pointers"
1400,F,x-prime Substrings,2800.0,"brute force, dfs and similar, dp, string suffix structures, strings"
1400,E,Clear the Multiset,2200.0,"data structures, divide and conquer, dp, greedy"
1400,D,Zigzags,1900.0,"brute force, combinatorics, data structures, math, two pointers"
1400,C,Binary String Reconstruction,1500.0,"2-sat, brute force, constructive algorithms, greedy"
1400,B,RPG Protagonist,1700.0,"brute force, greedy, math"
1400,A,String Similarity,800.0,"constructive algorithms, strings"
1399,F,Yet Another Segments Subset,2300.0,"data structures, dp, graphs, sortings"
1399,E2,Weights Division (hard version),2200.0,"binary search, dfs and similar, greedy, sortings, trees, two pointers"
1399,E1,Weights Division (easy version),2000.0,"data structures, dfs and similar, greedy, trees"
1399,D,Binary String To Subsequences,1500.0,"constructive algorithms, data structures, greedy, implementation"
1399,C,Boats Competition,1200.0,"brute force, greedy, two pointers"
1399,B,Gifts Fixing,800.0,greedy
1399,A,Remove Smallest,800.0,"greedy, sortings"
1398,G,Running Competition,2600.0,"bitmasks, fft, math, number theory"
1398,F,Controversial Rounds,2500.0,"binary search, data structures, dp, greedy, two pointers"
1398,E,Two Types of Spells,2200.0,"binary search, data structures, greedy, implementation, math, sortings"
1398,D,Colored Rectangles,1800.0,"dp, greedy, sortings"
1398,C,Good Subarrays,1600.0,"data structures, dp, math"
1398,B,Substring Removal Game,800.0,"games, greedy, sortings"
1398,A,Bad Triangle,800.0,"geometry, math"
1397,B,Power Sequence,1500.0,"brute force, math, number theory, sortings"
1397,A,Juggling Letters,800.0,"greedy, strings"
1396,E,Distance Matching,3200.0,"constructive algorithms, dfs and similar, trees"
1396,D,Rainbow Rectangles,3300.0,"data structures, sortings, two pointers"
1396,C,Monster Invaders,2300.0,"dp, greedy, implementation"
1396,B,Stoned Game,1800.0,"brute force, constructive algorithms, games, greedy"
1396,A,Multiples of Length,1600.0,"constructive algorithms, greedy, number theory"
1395,C,Boboniu and Bit Operations,1600.0,"bitmasks, brute force, dp, greedy"
1395,B,Boboniu Plays Chess,1100.0,constructive algorithms
1395,A,Boboniu Likes to Color Balls,1000.0,"brute force, math"
1394,E,Boboniu and Banknote Collection,3500.0,strings
1394,D,Boboniu and Jianghu,2800.0,"dp, greedy, sortings, trees"
1394,C,Boboniu and String,2600.0,"binary search, geometry, ternary search"
1394,B,Boboniu Walks on Graph,2300.0,"brute force, dfs and similar, graphs, hashing"
1394,A,Boboniu Chats with Du,1800.0,"dp, greedy, sortings, two pointers"
1393,E2,Twilight and Ancient Scroll (harder version),3200.0,"dp, hashing, implementation, string suffix structures, strings, two pointers"
1393,E1,Twilight and Ancient Scroll (easier version),2800.0,"dp, hashing, implementation, string suffix structures, strings"
1393,D,Rarity and New Dress,2100.0,"dfs and similar, dp, implementation, shortest paths"
1393,C,Pinkie Pie Eats Patty-cakes,1700.0,"constructive algorithms, greedy, math, sortings"
1393,B,Applejack and Storages,1400.0,"constructive algorithms, data structures, greedy, implementation"
1393,A,"Rainbow Dash, Fluttershy and Chess Coloring",800.0,"greedy, math"
1392,I,Kevin and Grid,3300.0,"fft, graphs, math"
1392,H,ZS Shuffles Cards,3000.0,"combinatorics, dp, math, probabilities"
1392,G,Omkar and Pies,2900.0,"bitmasks, dfs and similar, dp, math, shortest paths"
1392,F,Omkar and Landslide,2400.0,"binary search, constructive algorithms, data structures, greedy, math"
1392,E,Omkar and Duck,2100.0,"bitmasks, constructive algorithms, interactive, math"
1392,D,Omkar and Bed Wars,1700.0,"dp, greedy"
1392,C,Omkar and Waterslide,1200.0,"greedy, implementation"
1392,B,Omkar and Infinity Clock,800.0,"implementation, math"
1392,A,Omkar and Password,800.0,"greedy, math"
1391,E,Pairs of Pairs,2600.0,"constructive algorithms, dfs and similar, graphs, greedy, trees"
1391,D,505,2000.0,"bitmasks, brute force, constructive algorithms, dp, greedy, implementation"
1391,C,Cyclic Permutations ,1500.0,"combinatorics, dp, graphs, math"
1391,B,Fix You,800.0,"brute force, greedy, implementation"
1391,A,Suborrays,800.0,"constructive algorithms, math"
1389,G,Directing Edges,2800.0,"dfs and similar, dp, graphs, trees"
1389,F,Bicolored Segments,2600.0,"data structures, dp, graph matchings, sortings"
1389,E,Calendar Ambiguity,2200.0,"math, number theory"
1389,D,Segment Intersections,2100.0,"brute force, greedy, implementation, math"
1389,C,Good String,1500.0,"brute force, dp, greedy, two pointers"
1389,B,Array Walk,1600.0,"brute force, dp, greedy"
1389,A,LCM Problem,800.0,"constructive algorithms, greedy, math, number theory"
1388,E,Uncle Bogdan and Projections,2700.0,"data structures, geometry, sortings"
1388,D,Captain Flint and Treasure,2000.0,"data structures, dfs and similar, graphs, greedy, implementation, trees"
1388,C,Uncle Bogdan and Country Happiness,1800.0,"dfs and similar, greedy, math, trees"
1388,B,Captain Flint and a Long Voyage,1000.0,"greedy, math"
1388,A,Captain Flint and Crew Recruitment,800.0,"brute force, greedy, math, number theory"
1387,C,Viruses,2900.0,"*special, dp, shortest paths, string suffix structures"
1387,B2,Village (Maximum),2500.0,"*special, dfs and similar, trees"
1387,B1,Village (Minimum),2100.0,"*special, dp, greedy, trees"
1387,A,Graph,2100.0,"*special, binary search, dfs and similar, dp, math, ternary search"
1386,C,Joker,2800.0,"*special, bitmasks, data structures, divide and conquer, dsu"
1386,B,Mixture,2900.0,"*special, data structures, geometry, math, sortings"
1386,A,Colors,2700.0,"*special, binary search, constructive algorithms, interactive"
1385,G,Columns Swaps,2300.0,"2-sat, dfs and similar, dsu, graphs, implementation"
1385,F,Removing Leaves,2300.0,"data structures, greedy, implementation, trees"
1385,E,Directing Edges,2000.0,"constructive algorithms, dfs and similar, graphs"
1385,D,a-Good String,1500.0,"bitmasks, brute force, divide and conquer, dp, implementation"
1385,C,Make It Good,1200.0,greedy
1385,B,Restore the Permutation by Merger,800.0,greedy
1385,A,Three Pairwise Maximums,800.0,math
1384,B2,Koa and the Beach (Hard Version),2200.0,"constructive algorithms, dp, greedy, implementation"
1384,B1,Koa and the Beach (Easy Version),1900.0,"brute force, dp, greedy"
1384,A,Common Prefixes,1200.0,"constructive algorithms, greedy, strings"
1383,F,Special Edges,3200.0,"flows, graphs"
1383,E,Strange Operation,2800.0,"combinatorics, data structures, dp"
1383,D,Rearrange,2800.0,"brute force, constructive algorithms, graphs, greedy, sortings"
1383,C,String Transformation 2,3100.0,"bitmasks, dp, graphs, trees"
1383,B,GameGame,1900.0,"bitmasks, constructive algorithms, dp, games, greedy, math"
1383,A,String Transformation 1,1700.0,"dsu, graphs, greedy, sortings, strings, trees, two pointers"
1382,B,Sequential Nim,1100.0,"dp, games"
1382,A,Common Subsequence,800.0,brute force
1381,E,Origami,3300.0,"geometry, math, sortings"
1381,D,The Majestic Brown Tree Snake,3000.0,"dfs and similar, dp, greedy, trees, two pointers"
1381,C,Mastermind,2500.0,"constructive algorithms, graph matchings, greedy, implementation, sortings, two pointers"
1381,B,Unmerge,1800.0,dp
1381,A2,Prefix Flip (Hard Version),1700.0,"constructive algorithms, data structures, implementation, strings, two pointers"
1381,A1,Prefix Flip (Easy Version),1300.0,"constructive algorithms, data structures, strings"
1380,G,Circular Dungeon,2600.0,"greedy, math, probabilities"
1380,F,Strange Addition,2600.0,"data structures, dp, matrices"
1380,E,Merging Towers,2300.0,"data structures, dsu, implementation, trees"
1380,D,Berserk And Fireball,2000.0,"constructive algorithms, greedy, implementation, math, two pointers"
1380,C,Create The Teams,1400.0,"brute force, dp, greedy, implementation, sortings"
1380,B,Universal Solution,1400.0,greedy
1380,A,Three Indices,900.0,"brute force, data structures"
1379,F2,Chess Strikes Back (hard version),2800.0,"data structures, divide and conquer"
1379,F1,Chess Strikes Back (easy version),2700.0,"binary search, data structures"
1379,E,Inverse Genealogy,2800.0,"constructive algorithms, divide and conquer, dp, math, trees"
1379,D,New Passenger Trams,2300.0,"binary search, brute force, data structures, sortings, two pointers"
1379,C,Choosing flowers,2000.0,"binary search, brute force, data structures, dfs and similar, dp, greedy, sortings, two pointers"
1379,B,Dubious Cyrpto,1500.0,"binary search, brute force, math, number theory"
1379,A,Acacius and String,1500.0,"brute force, implementation, strings"
1375,I,Cubic Lattice,3500.0,"geometry, math, matrices, number theory"
1375,H,Set Merging,3300.0,"constructive algorithms, divide and conquer"
1375,G,Tree Modification,2800.0,"brute force, constructive algorithms, dfs and similar, graph matchings, graphs, trees"
1375,F,Integer Game,2600.0,"constructive algorithms, games, interactive, math"
1375,E,Inversion SwapSort,2500.0,"constructive algorithms, greedy, sortings"
1375,D,Replace by MEX,1900.0,"brute force, constructive algorithms, sortings"
1375,C,Element Extermination,1400.0,"constructive algorithms, data structures, greedy"
1375,B,Neighbor Grid,1200.0,"constructive algorithms, greedy"
1375,A,Sign Flipping,1100.0,"constructive algorithms, math"
1374,F,Cyclic Shifts Sorting,2400.0,"brute force, constructive algorithms, implementation, sortings"
1374,E2,Reading Books (hard version),2500.0,"data structures, greedy, implementation, sortings, ternary search, two pointers"
1374,E1,Reading Books (easy version),1600.0,"data structures, greedy, sortings"
1374,D,Zero Remainder Array,1400.0,"math, sortings, two pointers"
1374,C,Move Brackets,1000.0,"greedy, strings"
1374,B,"Multiply by 2, divide by 6",900.0,math
1374,A,Required Remainder,800.0,math
1373,G,Pawns,2600.0,"data structures, divide and conquer, greedy"
1373,F,Network Coverage,2400.0,"binary search, constructive algorithms, data structures, greedy"
1373,E,Sum of Digits,2200.0,"brute force, constructive algorithms, dp, greedy"
1373,D,Maximum Sum on Even Positions,1600.0,"divide and conquer, dp, greedy, implementation"
1373,C,Pluses and Minuses,1300.0,math
1373,B,01 Game,900.0,games
1373,A,Donut Shops,1000.0,"greedy, implementation, math"
1372,F,Omkar and Modes,2700.0,"binary search, divide and conquer, interactive"
1372,E,Omkar and Last Floor,2900.0,"dp, greedy, two pointers"
1372,D,Omkar and Circle,2100.0,"brute force, dp, games, greedy"
1372,C,Omkar and Baseball,1500.0,"constructive algorithms, math"
1372,B,Omkar and Last Class of Math,1300.0,"greedy, math, number theory"
1372,A,Omkar and Completion,800.0,"constructive algorithms, implementation"
1371,F,Raging Thunder,2800.0,"data structures, divide and conquer, implementation"
1371,E2,Asterism (Hard Version),2300.0,"binary search, combinatorics, dp, math, number theory, sortings"
1371,E1,Asterism (Easy Version),1900.0,"binary search, brute force, combinatorics, math, number theory, sortings"
1371,D,Grid-00100,1600.0,"constructive algorithms, greedy, implementation"
1371,C,A Cookie for You,1300.0,"greedy, implementation, math"
1371,B,Magical Calendar,1200.0,math
1371,A,Magical Sticks,800.0,math
1370,F2,The Hidden Pair (Hard Version),2700.0,"binary search, dfs and similar, graphs, interactive, shortest paths, trees"
1370,F1,The Hidden Pair (Easy Version),2400.0,"binary search, dfs and similar, graphs, interactive, shortest paths, trees"
1370,E,Binary Subsequence Rotation,2100.0,"binary search, constructive algorithms, data structures, greedy"
1370,D,Odd-Even Subsequence,2000.0,"binary search, dp, dsu, greedy, implementation"
1370,C,Number Game,1400.0,"games, math, number theory"
1370,B,GCD Compression,1100.0,"constructive algorithms, math, number theory"
1370,A,Maximum GCD,800.0,"greedy, implementation, math, number theory"
1369,F,BareLee,2700.0,"dfs and similar, dp, games"
1369,E,DeadLee,2400.0,"data structures, dfs and similar, greedy, implementation, sortings"
1369,D,TediousLee,1900.0,"dp, graphs, greedy, math, trees"
1369,C,RationalLee,1400.0,"greedy, math, sortings, two pointers"
1369,B,AccurateLee,1200.0,"greedy, implementation, strings"
1369,A,FashionabLee,800.0,"geometry, math"
1368,H2,Breadboard Capacity (hard version),3500.0,
1368,H1,Breadboard Capacity (easy version),3300.0,"dp, flows, greedy"
1368,G,Shifting Dominoes,3200.0,"data structures, geometry, graphs, trees"
1368,F,Lamps on a Circle,2600.0,"games, implementation, interactive, math"
1368,E,Ski Accidents,2500.0,"constructive algorithms, graphs, greedy"
1368,D,"AND, OR and square sum",1700.0,"bitmasks, greedy, math"
1368,C,Even Picture,1500.0,constructive algorithms
1368,B,Codeforces Subsequences,1500.0,"brute force, constructive algorithms, greedy, math, strings"
1368,A,C+=,800.0,"brute force, greedy, implementation, math"
1367,F2,Flying Sort (Hard Version),2400.0,"binary search, data structures, dp, greedy, sortings, two pointers"
1367,F1,Flying Sort (Easy Version),2100.0,"dp, greedy, two pointers"
1367,E,Necklace Assembly,1900.0,"brute force, dfs and similar, dp, graphs, greedy, number theory"
1367,D,Task On The Board,1800.0,"constructive algorithms, greedy, implementation, sortings"
1367,C,Social Distance,1300.0,"constructive algorithms, greedy, math"
1367,B,Even Array,800.0,"greedy, math"
1367,A,Short Substrings,800.0,"implementation, strings"
1366,G,Construct the String,2700.0,"data structures, dp, strings"
1366,F,Jog Around The Graph,2700.0,"binary search, dp, geometry, graphs"
1366,E,Two Arrays,2100.0,"binary search, brute force, combinatorics, constructive algorithms, dp, two pointers"
1366,D,Two Divisors,2000.0,"constructive algorithms, math, number theory"
1366,C,Palindromic Paths,1500.0,"greedy, math"
1366,B,Shuffle,1300.0,"math, two pointers"
1366,A,Shovels and Swords,1100.0,"binary search, greedy, math"
1365,G,Secure Password,2800.0,"bitmasks, combinatorics, constructive algorithms, interactive, math"
1365,F,Swaps Again,2100.0,"constructive algorithms, implementation, sortings"
1365,E,Maximum Subsequence Value,1900.0,"brute force, constructive algorithms"
1365,D,Solve The Maze,1700.0,"constructive algorithms, dfs and similar, dsu, graphs, greedy, implementation, shortest paths"
1365,C,Rotation Matching,1400.0,"constructive algorithms, data structures, greedy, implementation"
1365,B,Trouble Sort,1300.0,"constructive algorithms, implementation"
1365,A,Matrix Game,1100.0,"games, greedy, implementation"
1364,E,X-OR,2700.0,"bitmasks, constructive algorithms, divide and conquer, interactive, probabilities"
1364,D,Ehab's Last Corollary,2100.0,"constructive algorithms, dfs and similar, graphs, greedy, implementation, trees"
1364,C,Ehab and Prefix MEXs,1600.0,"brute force, constructive algorithms, greedy"
1364,B,Most socially-distanced subsequence,1300.0,"greedy, two pointers"
1364,A,XXXXX,1200.0,"brute force, data structures, number theory, two pointers"
1363,F,Rotating Substrings,2600.0,"dp, strings"
1363,E,Tree Shuffling,2000.0,"dfs and similar, dp, greedy, trees"
1363,D,Guess The Maximums,2100.0,"binary search, implementation, interactive, math"
1363,C,Game On Leaves,1600.0,"games, trees"
1363,B,Subsequence Hate,1400.0,"implementation, strings"
1363,A,Odd Selection,1200.0,"brute force, implementation, math"
1362,C,Johnny and Another Rating Drop,1400.0,"bitmasks, greedy, math"
1362,B,Johnny and His Hobbies,1200.0,"bitmasks, brute force"
1362,A,Johnny and Ancient Computer,1000.0,implementation
1361,F,Johnny and New Toy,3300.0,"data structures, implementation, math"
1361,E,James and the Chase,3000.0,"dfs and similar, graphs, probabilities, trees"
1361,D,Johnny and James,2900.0,"greedy, implementation, math, trees"
1361,C,Johnny and Megan's Necklace,2500.0,"binary search, bitmasks, constructive algorithms, dfs and similar, dsu, graphs"
1361,B,Johnny and Grandmaster,1900.0,"greedy, implementation, math, sortings"
1361,A,Johnny and Contribution,1700.0,"constructive algorithms, graphs, greedy, sortings"
1360,H,Binary Median,2100.0,"binary search, bitmasks, brute force, constructive algorithms"
1360,G,A/B Matrix,1900.0,"constructive algorithms, greedy, math"
1360,F,Spy-string,1700.0,"bitmasks, brute force, constructive algorithms, dp, hashing, strings"
1360,E,Polygon,1300.0,"dp, graphs, implementation, shortest paths"
1360,D,Buying Shovels,1300.0,"math, number theory"
1360,C,Similar Pairs,1100.0,"constructive algorithms, graph matchings, greedy, sortings"
1360,B,Honest Coach,800.0,"greedy, sortings"
1360,A,Minimal Square,800.0,"greedy, math"
1359,F,RC Kaboom Show,2900.0,"binary search, brute force, data structures, geometry, math"
1359,E,Modular Stability,2000.0,"combinatorics, math, number theory"
1359,D,Yet Another Yet Another Task,2000.0,"data structures, dp, implementation, two pointers"
1359,C,Mixing Water,1700.0,"binary search, math"
1359,B,New Theatre Square,1000.0,"brute force, dp, greedy, implementation, two pointers"
1359,A,Berland Poker,1000.0,"brute force, greedy, math"
1358,F,Tasty Cookie,2700.0,"binary search, constructive algorithms, greedy, implementation"
1358,E,Are You Fired?,2400.0,"constructive algorithms, data structures, greedy, implementation"
1358,D,The Best Vacation,1900.0,"binary search, brute force, greedy, implementation, two pointers"
1358,C,Celex Update,1600.0,math
1358,B,Maria Breaks the Self-isolation,1000.0,"greedy, sortings"
1358,A,Park Lighting,800.0,"greedy, math"
1357,E2,Root of quantum Fourier transform,,*special
1357,E1,Power of quantum Fourier transform,,*special
1357,D5,Quantum Classification - Dataset 7,,*special
1357,D4,Quantum Classification - Dataset 6,,*special
1357,D3,Quantum Classification - Dataset 5,,*special
1357,D2,Quantum Classification - Dataset 4,,*special
1357,D1,Quantum Classification - Dataset 3,,*special
1357,C2,Prepare superposition of basis states with the same parity,,*special
1357,C1,Prepare superposition of basis states with 0s,,*special
1357,B2,"""Is the number divisible by 3?"" oracle",,*special
1357,B1,"""Is the bit string balanced?"" oracle",,*special
1357,A7,"Distinguish Y, XZ, -Y and -XZ",,*special
1357,A6,Distinguish four Pauli gates,,*special
1357,A5,Distinguish Rz(θ) from Ry(θ),,*special
1357,A4,Distinguish Rz from R1,,*special
1357,A3,Distinguish H from X,,*special
1357,A2,"Distinguish I, CNOTs and SWAP",,*special
1357,A1,Figure out direction of CNOT,,*special
1356,D2,Quantum Classification - 2,,*special
1356,D1,Quantum Classification - 1,,*special
1356,C,Prepare state |01⟩ + |10⟩ + |11⟩,,*special
1356,B2,Decrement,,*special
1356,B1,Increment,,*special
1356,A5,Distinguish Z from -Z,,*special
1356,A4,Distinguish I ⊗ X from CNOT,,*special
1356,A3,Distinguish Z from S,,*special
1356,A2,Distinguish I from Z,,*special
1356,A1,Distinguish I from X,,*special
1355,F,Guess Divisors Count,2600.0,"constructive algorithms, interactive, number theory"
1355,E,Restorer Distance,2100.0,"binary search, greedy, math, sortings, ternary search"
1355,D,Game With Array,1400.0,"constructive algorithms, math"
1355,C,Count Triangles,1800.0,"binary search, implementation, math, two pointers"
1355,B,Young Explorers,1200.0,"dp, greedy, sortings"
1355,A,Sequence with Digits,1200.0,"brute force, implementation, math"
1354,G,Find a Gift,2600.0,"binary search, interactive, probabilities"
1354,F,Summoning Minions,2500.0,"constructive algorithms, dp, flows, graph matchings, greedy, sortings"
1354,E,Graph Coloring,2100.0,"dfs and similar, dp, graphs"
1354,D,Multiset,1900.0,"binary search, data structures"
1354,C2,Not So Simple Polygon Embedding,2000.0,"binary search, brute force, geometry, math"
1354,C1,Simple Polygon Embedding,1400.0,"binary search, geometry, math, ternary search"
1354,B,Ternary String,1200.0,"binary search, dp, implementation, two pointers"
1354,A,Alarm Clock,900.0,math
1353,F,Decreasing Heights,2200.0,"brute force, dp"
1353,E,K-periodic Garland,1900.0,"brute force, dp, greedy"
1353,D,Constructing the Array,1600.0,"constructive algorithms, data structures, sortings"
1353,C,Board Moves,1000.0,math
1353,B,Two Arrays And Swaps,800.0,"greedy, sortings"
1353,A,Most Unstable Array,800.0,"constructive algorithms, greedy, math"
1352,G,Special Permutation,1600.0,constructive algorithms
1352,F,Binary String Reconstruction,1500.0,"constructive algorithms, dfs and similar, math"
1352,E,Special Elements,1500.0,"brute force, implementation, two pointers"
1352,D,"Alice, Bob and Candies",1300.0,implementation
1352,C,K-th Not Divisible by n,1200.0,"binary search, math"
1352,B,Same Parity Summands,1200.0,"constructive algorithms, math"
1352,A,Sum of Round Numbers,800.0,"implementation, math"
1351,C,Skier,1400.0,"data structures, implementation"
1351,B,Square?,900.0,"brute force, implementation, math"
1351,A,A+B (Trial Problem),800.0,implementation
1350,B,Orac and Models,1400.0,"dp, math, number theory"
1350,A,Orac and Factors,900.0,math
1349,F2,Slime and Sequences (Hard Version),3500.0,"dp, fft, math"
1349,F1,Slime and Sequences (Easy Version),3100.0,"dp, fft, math"
1349,E,Slime and Hats,3500.0,"constructive algorithms, dp, greedy"
1349,D,Slime and Biscuits,3200.0,"math, probabilities"
1349,C,Orac and Game of Life,2000.0,"dfs and similar, graphs, implementation, shortest paths"
1349,B,Orac and Medians,2000.0,"constructive algorithms, greedy, math"
1349,A,Orac and LCM,1600.0,"data structures, math, number theory"
1348,F,Phoenix and Memory,2600.0,"data structures, dfs and similar, graphs, greedy"
1348,E,Phoenix and Berries,2400.0,"brute force, dp, greedy, math"
1348,D,Phoenix and Science,1900.0,"binary search, constructive algorithms, greedy, implementation, math"
1348,C,Phoenix and Distribution,1600.0,"constructive algorithms, greedy, sortings, strings"
1348,B,Phoenix and Beauty,1400.0,"constructive algorithms, data structures, greedy, sortings"
1348,A,Phoenix and Balance,800.0,"greedy, math"
1346,I,Pac-Man 2.0,2900.0,"*special, dp"
1346,H,Game with Segments,2700.0,"*special, data structures, games"
1346,G,Two IP Cameras,2300.0,"*special, math, number theory"
1346,F,Dune II: Battle For Arrakis,2000.0,"*special, data structures, greedy, math"
1346,E,Magic Tricks,1700.0,"*special, dp, graphs"
1346,D,Constructing the Dungeon,1600.0,"*special, graphs, greedy"
1346,C,Spring Cleaning,1600.0,"*special, greedy, sortings"
1346,B,Boot Camp,1400.0,"*special, greedy"
1346,A,Color Revolution,1000.0,"*special, math"
1345,B,Card Constructions,1100.0,"binary search, brute force, dp, math"
1345,A,Puzzle Pieces,800.0,math
1344,F,Piet's Palette,3200.0,matrices
1344,E,Train Tracks,3100.0,"data structures, trees"
1344,D,Résumé Review,2700.0,"binary search, greedy, math"
1344,C,Quantifier Question,2600.0,"dfs and similar, dp, graphs, math"
1344,B,Monopole Magnets,2000.0,"constructive algorithms, dfs and similar, dsu, graphs"
1344,A,Hilbert's Hotel,1600.0,"math, number theory, sortings"
1343,F,Restore the Permutation by Sorted Segments,2400.0,"brute force, constructive algorithms, data structures, greedy, implementation"
1343,E,Weights Distributing,2100.0,"brute force, graphs, greedy, shortest paths, sortings"
1343,D,Constant Palindrome Sum,1700.0,"brute force, data structures, greedy, two pointers"
1343,C,Alternating Subsequence,1200.0,"dp, greedy, two pointers"
1343,B,Balanced Array,800.0,"constructive algorithms, math"
1343,A,Candies,900.0,"brute force, math"
1342,F,Make It Ascending,3000.0,"bitmasks, brute force, dp"
1342,E,Placing Rooks,2300.0,"combinatorics, fft, math"
1342,D,Multiple Testcases,1900.0,"binary search, constructive algorithms, data structures, greedy, sortings, two pointers"
1342,C,Yet Another Counting Problem,1600.0,"math, number theory"
1342,B,Binary Period,1100.0,"constructive algorithms, strings"
1342,A,Road To Zero,1000.0,"greedy, math"
1341,B,Nastya and Door,1300.0,"greedy, implementation"
1341,A,Nastya and Rice,900.0,math
1340,F,Nastya and CBS,3300.0,"brute force, data structures, hashing"
1340,D,Nastya and Time Machine,2600.0,"constructive algorithms, dfs and similar, graphs, trees"
1340,C,Nastya and Unexpected Guest,2400.0,"dfs and similar, dp, graphs, shortest paths"
